id,response,respondent_id,timestamp,topic
731,Cricket provides opportunities for players from disadvantaged backgrounds and cricket needs to be more accessible to people from all socioeconomic backgrounds,R731,2024-02-16 18:56:57,Social
732,CRICKET GROUNDS WITH HISTORICAL SIGNIFICANCE PROVIDE A UNIQUE ATMOSPHERE OVERALL,R732,2024-02-16 19:26:45,Experience
733,"I have to say, the pressure on modern cricketers from social media is unprecedented",R733,2024-02-16 20:05:02,Media
734,The passion for cricket in the Indian subcontinent is extraordinary in my opinion,R734,2024-02-16 20:40:06,Culture
735,The Ashes series represents the pinnacle of cricket tradition and sporting heritage if I'm being honest,R735,2024-02-16 20:55:32,Tournament
736,"I mean, the social aspect of village cricket is as crucial as the game itself",R736,2024-02-16 21:12:20,Community
737,"Overall, the India-Pakistan rivalry is unmatched in sporting intensity and passion overall",R737,2024-02-16 21:33:55,Rivalry
738,"I gotta say, the rivalry between Australia and England defines the sport's heritage",R738,2024-02-16 22:02:16,Rivalry
739,"The bond between cricket teammates often lasts long after playing days end, also cricket has produced friendships across national boundaries and rivalries",R739,2024-02-16 22:29:37,Relationships
740,Cricket has given me a framework for understanding team dynamics - playing cricket has taught me more about myself than any other activity honestly,R740,2024-02-16 22:50:28,Personal
741,"I mean, the artistry of batting against spin on turning pitches is genuinely beautiful to watch",R741,2024-02-16 23:16:46,Batting
742,"In all honesty, the tactical battle in a Test match can shift multiple times across five days and the strategic nuances of field placements fascinate me as a cricket fan",R742,2024-02-16 23:31:02,Strategy
743,"Women's cricket has grown tremendously and deserves equal recognition and support. Additionally, young players need more exposure to red-ball cricket to develop properly",R743,2024-02-16 23:48:29,Development
744,Playing cricket in different conditions teaches adaptability and resilience honestly,R744,2024-02-17 00:32:32,Personal
745,"The tradition of tea intervals adds to cricket's unique charm. Additionally, cricket's etiquette and traditions distinguish it from other sports",R745,2024-02-17 00:47:20,Tradition
746,"All things considered, rapid bowling is an art form that combines athleticism skill and intimidation",R746,2024-02-17 01:28:36,Bowling
747,Test cricket teaches patience and perseverance unlike any other format all in all,R747,2024-02-17 02:00:57,Format
748,The social aspect of village cricket is as crucial as the game itself,R748,2024-02-17 02:43:38,Community
749,"I mean, test cricket demands sustained concentration that other formats don't require",R749,2024-02-17 03:26:39,Format
750,"Cricket in schools is essential for developing future players and fans. Additionally, young players need more exposure to red-ball cricket to develop properly",R750,2024-02-17 04:03:36,Development
751,"To be honest, the tactical battle between captain and opposition fascinates me",R751,2024-02-17 04:37:37,Strategy
752,Cricket's appeal lies in its combination of individual excellence and team success but cricket teaches the importance of playing within the rules while competing hard,R752,2024-02-17 05:07:28,Values
753,The tactical complexity of field placements reveals a captain's acumen but the strategic nuances of field placements fascinate me as a cricket fan overall,R753,2024-02-17 05:52:20,Strategy
754,"Basically, the standard of catching in international cricket has improved dramatically but the role of the wicketkeeper has evolved with new batting demands",R754,2024-02-17 05:57:20,Skills
755,THE MENTAL STRENGTH REQUIRED FOR TEST CRICKET MAKES IT THE ULTIMATE EXAMINATION IF I'M BEING HONEST,R755,2024-02-17 06:02:27,Psychology
756,"I have to say, really Fast bowling injuries remain a significant concern for player welfare",R756,2024-02-17 06:17:02,Health
757,"All things considered, cricket grounds with historical significance provide a unique atmosphere",R757,2024-02-17 06:40:18,Experience
758,"I gotta say, the passion for cricket in the Indian subcontinent is extraordinary",R758,2024-02-17 06:49:12,Culture
759,Modern umpiring technology has improved decision accuracy significantly in general,R759,2024-02-17 07:10:44,Technology
760,THE TRANSFORMATION OF FIELDING STANDARDS HAS RAISED THE OVERALL LEVEL OF CRICKET TO BE HONEST,R760,2024-02-17 07:27:23,Skills
761,The legacy of great players inspires new generations to take up the sport in my opinion,R761,2024-02-17 08:02:21,History
762,"In all honesty, the community aspect of club cricket brings people together across generations",R762,2024-02-17 08:34:09,Community
763,The quality of pitches significantly impacts the balance between bat and ball - the unpredictability of weather in Test cricket adds an extra strategic element,R763,2024-02-17 08:39:25,Conditions
764,The commercial success of T20 has funded development in other formats I think,R764,2024-02-17 09:19:38,Business
765,Cricket teaches the importance of playing within the rules while competing hard. cricket's appeal lies in its combination of individual excellence and team success,R765,2024-02-17 09:57:18,Values
766,"To be honest, the variation in bowling speeds and lengths keeps batsmen guessing",R766,2024-02-17 10:36:36,Bowling
767,Modern batting techniques have evolved to counter specific bowling threats. a perfectly timed cover drive is the most elegant shot in cricket,R767,2024-02-17 11:04:02,Batting
768,The role of the third umpire has become increasingly important in modern cricket overall,R768,2024-02-17 11:46:37,Technology
769,FORMER PLAYERS BRING INVALUABLE INSIGHTS TO COACHING AND DEVELOPMENT,R769,2024-02-17 11:54:44,Development
770,Young fast bowlers need better workload management to prevent injuries for sure,R770,2024-02-17 12:32:48,Health
771,"Cricket's long matches create unique opportunities for comebacks and drama. Additionally, the atmosphere of a full house at Lord's is unmatched in cricket",R771,2024-02-17 13:16:11,Experience
772,Modern coaching has transformed how players approach fitness and mental preparation and cricket in schools is essential for developing future players and fans,R772,2024-02-17 13:27:40,Development
773,The mental game in cricket is as essential as physical skills,R773,2024-02-17 14:00:45,Psychology
774,Wrist spin bowling is experiencing a welcome renaissance in modern cricket I think,R774,2024-02-17 14:08:11,Bowling
775,"The mental strength to recover from poor form separates great players, also the pressure of representing your country in cricket is immense",R775,2024-02-17 14:45:22,Psychology
776,"To be honest, local cricket clubs form the foundation of the sport's development pyramid",R776,2024-02-17 14:56:10,Community
777,"The unpredictability of weather in Test cricket adds an extra strategic element. Additionally, the unpredictability of cricket on different surfaces keeps the game fascinating",R777,2024-02-17 15:38:44,Conditions
778,Limited overs cricket has produced some of the most thrilling finishes in sporting history I think,R778,2024-02-17 15:57:43,Format
779,it was okay,R779,2024-02-17 16:41:40,Health
780,"To be honest, the experience of playing cricket at iconic venues is something special",R780,2024-02-17 16:52:11,Experience
781,"Cricket provides a healthy outlet for competitive instincts. Additionally, cricket has given me a framework for understanding team dynamics in general",R781,2024-02-17 17:14:25,Personal
782,The pressure on modern cricketers from social media is unprecedented - cricket commentary has evolved with more analysis and entertainment value,R782,2024-02-17 17:54:30,Media
783,"I have to say, cricket needs to be more accessible to people from all socioeconomic backgrounds",R783,2024-02-17 18:27:43,Social
784,Cricket provides valuable life lessons about handling success and failure. cricket teaches the importance of playing within the rules while competing hard,R784,2024-02-17 18:56:25,Values
785,"The variety of shots in a batsman's repertoire reflects years of practice. Additionally, wicketkeeping is an underappreciated skill that requires exceptional concentration",R785,2024-02-17 19:33:45,Skills
786,"Basically, the rivalry between bat and ball makes every delivery an individual contest all in all",R786,2024-02-17 20:03:00,Competition
787,Watching cricket with family has created cherished childhood memories. watching cricket with knowledgeable fans enhances the viewing experience for sure,R787,2024-02-17 20:09:53,Community
788,The role of the all-rounder has become increasingly valued in modern cricket - the transformation of fielding standards has raised the overall level of cricket,R788,2024-02-17 20:38:08,Skills
789,"I have to say, cricket has a unique ability to bring together people from diverse backgrounds",R789,2024-02-17 20:43:29,Community
790,The role of the wicketkeeper has evolved with new batting demands but the standard of catching in international cricket has improved dramatically,R790,2024-02-17 21:16:15,Skills
791,The role of the captain in cricket is more significant than in most team sports,R791,2024-02-17 21:46:48,Leadership
792,THE ART OF SWING BOWLING SEEMS TO BE DECLINING IN MODERN CRICKET,R792,2024-02-17 22:25:30,Bowling
793,"I mean, the County Championship remains the bedrock of English cricket development",R793,2024-02-17 22:35:09,Domestic
794,Modern technology has revealed the complexity of bowling actions in my opinion,R794,2024-02-17 23:01:38,Technology
795,"Basically, wicketkeeping is an underappreciated skill that requires exceptional concentration",R795,2024-02-17 23:12:46,Skills
796,Test cricket teaches patience and perseverance unlike any other format. test cricket demands sustained concentration that other formats don't require,R796,2024-02-17 23:43:07,Format
797,The commercial success of T20 has funded development in other formats and the economic impact of major cricket tournaments benefits local communities,R797,2024-02-18 00:01:14,Business
798,Cricket has helped me develop resilience and handle pressure situations but playing cricket builds character and teaches handling of adversity,R798,2024-02-18 00:17:52,Personal
799,The atmosphere at regional cricket matches can be incredibly passionate but the experience of playing cricket at iconic venues is something special I think,R799,2024-02-18 00:41:53,Experience
800,Local cricket creates social bonds that extend far beyond the playing field - the social aspect of village cricket is as important as the game itself,R800,2024-02-18 01:03:20,Community
801,The Ranji Trophy remains India's most prestigious domestic competition tbh,R801,2024-02-18 01:48:31,Domestic
802,"I have to say, cricket grounds with historical significance provide a unique atmosphere",R802,2024-02-18 01:55:44,Experience
803,"The decline of leg-spin bowling in some countries is concerning. Additionally, pace bowlers today are stronger and faster than ever before",R803,2024-02-18 02:16:02,Bowling
804,The mental strength to recover from poor form separates great players I think,R804,2024-02-18 02:59:17,Psychology
805,Cricket has given me a framework for understanding team dynamics but playing cricket has taught me more about myself than any other activity,R805,2024-02-18 03:26:45,Personal
806,Cricket brings out both the best and worst in terms of crowd behavior and the passion for cricket in the Indian subcontinent is extraordinary,R806,2024-02-18 04:00:32,Culture
807,Local derby matches create intense rivalries in domestic cricket overall,R807,2024-02-18 04:30:57,Domestic
808,"Basically, test match cricket provides the ultimate examination of technique and temperament",R808,2024-02-18 05:05:42,Format
809,"Cricket needs to address issues of inclusivity and diversity more actively. Additionally, cricket needs to be more accessible to people from all socioeconomic backgrounds",R809,2024-02-18 05:15:00,Social
810,The atmosphere during a World Cup final is indescribable - the World Cup is the ultimate stage for any cricketer representing their nation really,R810,2024-02-18 05:29:51,Tournament
811,"Basically, playing cricket has helped me develop leadership and communication skills",R811,2024-02-18 05:45:59,Personal
812,Cricket's global calendar needs upgraded coordination between boards,R812,2024-02-18 05:58:00,Governance
813,Young cricketers today have access to coaching and facilities previous generations could only dream of I think,R813,2024-02-18 06:37:18,Development
814,The strategic nuances of field placements fascinate me as a cricket fan and the tactical awareness required in cricket develops with experience and study,R814,2024-02-18 06:51:06,Strategy
815,The rivalry between Australia and England defines the sport's heritage but cricket has produced some of the greatest sporting rivalries in history,R815,2024-02-18 07:13:46,Rivalry
816,"All things considered, the evolution of batting techniques reflects changing pitch conditions and formats",R816,2024-02-18 07:38:22,Batting
817,Young efficient bowlers need very better workload management to prevent injuries,R817,2024-02-18 07:54:41,Health
818,nothing,R818,2024-02-18 08:28:49,History
819,The mental game in cricket is as important as physical skills but the mental strength required for Test cricket makes it the ultimate examination,R819,2024-02-18 09:08:15,Psychology
820,Cricket has helped me develop resilience and handle pressure situations and playing cricket has helped me develop leadership and communication skills,R820,2024-02-18 09:41:18,Personal
821,The role of the captain in cricket is more significant than in most team sports in my opinion,R821,2024-02-18 10:13:24,Leadership
822,"I mean, local derby matches create intense rivalries in domestic cricket",R822,2024-02-18 10:55:14,Domestic
823,"Basically, the atmosphere of a full house at Lord's is unmatched in cricket",R823,2024-02-18 10:58:28,Experience
824,Cricket teaches the importance of playing within the rules while competing hard but playing cricket taught me valuable lessons about teamwork and sportsmanship,R824,2024-02-18 11:07:10,Values
825,Cricket boards need better governance and transparency in decision-making - cricket administrators must balance tradition with necessary modernization,R825,2024-02-18 11:46:04,Governance
826,"Cricket needs to address issues of player burnout more seriously, also fast bowling injuries remain a significant concern for player welfare",R826,2024-02-18 12:07:24,Health
827,"I mean, the pressure of representing your country in cricket is immense really",R827,2024-02-18 12:42:31,Psychology
828,"Playing cricket in different conditions teaches adaptability and resilience. Additionally, cricket provides a healthy outlet for competitive instincts",R828,2024-02-18 13:26:59,Personal
829,"Looking back, playing cricket in different conditions teaches adaptability and resilience",R829,2024-02-18 14:01:27,Personal
830,"Truthfully, the rotation of strike in limited overs cricket requires intelligent running",R830,2024-02-18 14:07:30,Skills
831,The experience of watching cricket live is far superior to television and cricket's long matches create unique opportunities for comebacks and drama,R831,2024-02-18 14:35:09,Experience
832,"In my experience, the psychological battle between bowler and batsman is endlessly fascinating",R832,2024-02-18 15:13:41,Psychology
833,"All things considered, local cricket creates social bonds that extend far beyond the playing field",R833,2024-02-18 15:41:03,Community
834,Cricket has a unique ability to bring together people from diverse backgrounds I think,R834,2024-02-18 15:55:41,Community
835,"Looking back, cricket needs to address issues of inclusivity and diversity more actively",R835,2024-02-18 16:41:21,Social
836,"TO BE HONEST, THE ROLE OF THE WICKETKEEPER HAS EVOLVED WITH NEW BATTING DEMANDS",R836,2024-02-18 17:12:37,Skills
837,"Truthfully, cricket needs to address issues of inclusivity and diversity more actively",R837,2024-02-18 17:22:40,Social
838,"Cricket has produced some of the greatest sporting rivalries in history. Additionally, the India-Pakistan rivalry is unmatched in sporting intensity and passion",R838,2024-02-18 17:36:56,Rivalry
839,THE PSYCHOLOGICAL IMPACT OF A DROPPED CATCH CAN SHIFT MOMENTUM DRAMATICALLY - THE PSYCHOLOGICAL BATTLE BETWEEN BOWLER AND BATSMAN IS ENDLESSLY FASCINATING,R839,2024-02-18 17:59:49,Psychology
840,"In all honesty, cricket has provided me with lifelong friendships and cherished memories",R840,2024-02-18 18:23:33,Personal
841,Cricket in schools is essential for developing future players and fans in my opinion,R841,2024-02-18 18:49:19,Development
842,CRICKET TEACHES THE VALUE OF PATIENCE IN AN INCREASINGLY IMPATIENT WORLD OVERALL,R842,2024-02-18 19:00:48,Values
843,"Looking back, the commercialization of cricket has both positive and negative consequences",R843,2024-02-18 19:06:19,Business
844,"I mean, batting in challenging conditions separates great players from positive ones",R844,2024-02-18 19:25:35,Batting
845,Pace bowlers today are stronger and faster than ever before honestly,R845,2024-02-18 20:07:54,Bowling
846,The physical and mental demands of fast bowling deserve greater recognition. the art of swing bowling seems to be declining in modern cricket,R846,2024-02-18 20:13:24,Bowling
847,Cricket's global expansion to new markets is essential for the sport's future but women's cricket has grown tremendously and deserves equal recognition and support,R847,2024-02-18 20:47:42,Development
848,Cricket academies are developing talent earlier than ever before honestly,R848,2024-02-18 21:24:19,Development
849,"From my perspective, the tactical complexity of field placements reveals a captain's acumen to be honest",R849,2024-02-18 21:47:43,Strategy
850,The atmosphere during a World Cup final is indescribable really,R850,2024-02-18 21:55:22,Tournament
851,Cricket administrators must balance tradition with necessary modernization for sure,R851,2024-02-18 22:39:41,Governance
852,Pace bowlers today are stronger and faster than ever before for sure,R852,2024-02-18 23:06:36,Bowling
853,Test cricket is the purest form of the game requiring resilience strategy and mental strength over five days for sure,R853,2024-02-18 23:33:17,Format
854,"I mean, cricket's ability to produce draws adds a unique strategic dimension. Additionally, test cricket needs innovation to remain relevant to younger audiences",R854,2024-02-19 00:13:10,Format
855,"To be honest, the tactical awareness required in cricket develops with experience and study tbh",R855,2024-02-19 00:47:14,Strategy
856,"Looking back, cricket needs to be more accessible to people from all socioeconomic backgrounds",R856,2024-02-19 01:21:42,Social
857,"In my experience, local cricket clubs struggle with declining participation and funding",R857,2024-02-19 01:58:57,Community
858,Cricket grounds with historical significance provide a unique atmosphere. the tension of a close Test match is incomparable to any other sporting experience,R858,2024-02-19 02:34:25,Experience
859,I'd say that playing cricket builds character and teaches handling of adversity and cricket has given me some of my closest friendships and fondest memories,R859,2024-02-19 02:50:59,Personal
860,The beauty of cricket lies in its ability to produce unexpected results in general,R860,2024-02-19 03:28:43,Experience
861,"Cricket's traditions should be preserved while embracing necessary innovation. Additionally, cricket's traditions should evolve naturally rather than be artificially preserved",R861,2024-02-19 03:38:34,Tradition
862,The decline of leg-spin bowling in some countries is concerning all in all,R862,2024-02-19 03:48:52,Bowling
863,Pace bowlers today are stronger and faster than ever before really,R863,2024-02-19 04:15:10,Bowling
864,"All things considered, playing cricket overseas broadens perspectives and builds global connections",R864,2024-02-19 04:49:37,Culture
865,"Truthfully, the variety of shots in a batsman's repertoire reflects years of practice honestly",R865,2024-02-19 05:07:34,Skills
866,"Looking back, cricket's colonial history adds complex layers to international rivalries",R866,2024-02-19 05:50:15,History
867,Cricket's gentle pace allows for appreciation of individual battles within the team context but the atmosphere of a full house at Lord's is unmatched in cricket,R867,2024-02-19 06:06:27,Experience
868,"Truthfully, the experience of playing cricket at iconic venues is something special",R868,2024-02-19 06:15:55,Experience
869,"Pink ball Tests have shown promise in attracting evening crowds, also the development of switch-hitting has added new dimensions to batting",R869,2024-02-19 06:30:09,Innovation
870,Cricket administrators must balance tradition with necessary modernization. the ICC needs to do more to support cricket in emerging nations,R870,2024-02-19 06:50:51,Governance
871,The camaraderie in cricket dressing rooms creates lifelong friendships but the social aspect of village cricket is as important as the game itself,R871,2024-02-19 07:25:13,Community
872,Test cricket is the purest form of the game requiring resilience strategy and mental strength over five days - test match cricket provides the ultimate examination of technique and temperament in general,R872,2024-02-19 07:48:29,Format
873,A perfectly timed cover drive is the most elegant shot in cricket. building an innings in Test cricket is a lost art that needs revival,R873,2024-02-19 07:55:56,Batting
874,"All things considered, cricket brings out both the best and worst in terms of crowd behavior",R874,2024-02-19 08:06:15,Culture
875,The art of swing bowling seems to be declining in modern cricket really,R875,2024-02-19 08:28:19,Bowling
876,"To be honest, the art of building partnerships is fundamental to successful batting",R876,2024-02-19 08:31:50,Batting
877,The sound of leather on willow is one of the most satisfying sounds in sport and cricket grounds with character and history provide unique playing experiences,R877,2024-02-19 09:16:12,Experience
878,The development of power hitting has changed limited overs cricket dramatically. the importance of a solid defensive technique is often undervalued in modern cricket,R878,2024-02-19 09:22:46,Batting
879,Cricket has helped me develop resilience and handle pressure situations but cricket has given me a framework for understanding team dynamics,R879,2024-02-19 10:04:24,Personal
880,Women's cricket has grown tremendously and deserves equal recognition and support - the emergence of associate nations has added depth to world cricket in general,R880,2024-02-19 10:20:27,Development
881,n/a,R881,2024-02-19 10:37:49,Development
882,Cricket brings families together on lazy summer afternoons. the camaraderie in cricket dressing rooms creates lifelong friendships,R882,2024-02-19 10:50:15,Community
883,"Women's cricket has grown tremendously and deserves equal recognition and support, also the emergence of cricket in non-traditional markets shows the sport's potential",R883,2024-02-19 10:59:05,Development
884,I'd say that cricket's global expansion to new markets is essential for the sport's future,R884,2024-02-19 11:04:07,Development
885,The variety of cricket formats now available caters to different preferences I think,R885,2024-02-19 11:36:45,Format
886,Cricket needs to be more accessible to people from all socioeconomic backgrounds but cricket provides opportunities for players from disadvantaged backgrounds,R886,2024-02-19 12:08:48,Social
887,"In my experience, local cricket creates social bonds that extend far beyond the playing field",R887,2024-02-19 12:43:10,Community
888,"The economic impact of major cricket tournaments benefits local communities, also the commercial success of T20 has funded development in other formats",R888,2024-02-19 12:58:31,Business
889,"To be honest, the Ranji Trophy remains India's most prestigious domestic competition",R889,2024-02-19 13:25:57,Domestic
890,The bond between cricket teammates often lasts extended after playing days end,R890,2024-02-19 13:30:31,Relationships
891,"To be honest, cricket's global expansion to new markets is essential for the sport's future",R891,2024-02-19 13:56:37,Development
892,"Cricket brings families together on lazy summer afternoons. Additionally, cricket has a unique ability to bring together people from diverse backgrounds",R892,2024-02-19 14:10:03,Community
893,"The legacy of great players inspires new generations to take up the sport, also cricket's colonial history adds complex layers to international rivalries",R893,2024-02-19 14:33:10,History
894,I'd say that playing conditions should favor a fair contest between bat and ball - the unpredictability of cricket on different surfaces keeps the game fascinating,R894,2024-02-19 15:10:29,Conditions
895,"In all honesty, cricket has a unique ability to bring together people from diverse backgrounds",R895,2024-02-19 15:18:31,Community
896,Cricket statistics help us appreciate performances across different eras. the statistical depth of cricket appeals to analytically minded fans honestly,R896,2024-02-19 15:57:17,Statistics
897,The mental game in cricket is as vital as physical skills,R897,2024-02-19 16:37:31,Psychology
898,Cricket's global expansion to new markets is essential for the sport's future but the emergence of Afghan cricket has been remarkable given the country's challenges,R898,2024-02-19 17:17:07,Development
899,"In my experience, cricket teaches children discipline patience and respect for opponents",R899,2024-02-19 17:20:09,Values
900,The sound of leather on willow is one of the most satisfying sounds in sport. the beauty of cricket lies in its ability to produce unexpected results,R900,2024-02-19 17:34:05,Experience
