id,response,respondent_id,timestamp,topic
398,Test cricket should maintain its five-day format despite commercial pressures really,R398,2024-02-11 01:59:23,Tradition
399,"Honestly, the rivalry between subcontinent teams creates unparalleled passion",R399,2024-02-11 02:34:55,Rivalry
400,Modern batting techniques have evolved to counter specific bowling threats but a perfectly timed cover drive is the most elegant shot in cricket,R400,2024-02-11 03:11:07,Batting
401,Investment in women's cricket is beginning to show results at the highest level but cricket's global reach continues to expand into new territories,R401,2024-02-11 03:32:28,Development
402,"Overall, the World Cup is the ultimate stage for any cricketer representing their nation - the atmosphere during a World Cup final is indescribable",R402,2024-02-11 03:37:44,Tournament
403,Test cricket is the purest form of the game requiring resilience strategy and mental strength over five days overall,R403,2024-02-11 04:15:00,Format
404,"I gotta say, the mental strength to recover from poor form separates great players",R404,2024-02-11 04:35:00,Psychology
405,The Sheffield Shield has produced some of Australia's greatest cricketers in my opinion,R405,2024-02-11 04:38:07,Domestic
406,"Truthfully, modern coaching has transformed how players approach fitness and mental preparation",R406,2024-02-11 04:58:37,Development
407,"The growth of women's cricket has been one of the sport's great success stories, also young cricketers today have access to coaching and facilities previous generations could only dream of overall",R407,2024-02-11 05:13:37,Development
408,"All things considered, the IPL has revolutionized cricket making it more accessible and entertaining for younger audiences",R408,2024-02-11 05:53:36,T20
409,"Looking back, cricket's global reach continues to expand into new territories honestly",R409,2024-02-11 06:11:42,Development
410,"Looking back, limited overs cricket has produced some of the most thrilling finishes in sporting history really",R410,2024-02-11 06:55:57,Format
411,"Honestly, the mental game in cricket is as important as physical skills. Additionally, the mental strength required for Test cricket makes it the ultimate examination",R411,2024-02-11 07:41:13,Psychology
412,The psychological impact of a dropped catch can shift momentum dramatically - the psychological battle between bowler and batsman is endlessly fascinating,R412,2024-02-11 08:22:01,Psychology
413,"Cricket's traditions should evolve naturally rather than be artificially preserved. Additionally, test cricket should maintain its five-day format despite commercial pressures",R413,2024-02-11 08:59:01,Tradition
414,The art of swing bowling seems to be declining in modern cricket if I'm being honest,R414,2024-02-11 09:31:55,Bowling
415,"Truthfully, women's cricket has grown tremendously and deserves equal recognition and support I think",R415,2024-02-11 09:45:00,Development
416,The pressure of representing your country in cricket is immense. the psychological impact of a dropped catch can shift momentum dramatically,R416,2024-02-11 10:02:03,Psychology
417,Test match cricket provides the ultimate examination of technique and temperament - test cricket teaches patience and perseverance unlike any other format,R417,2024-02-11 10:28:11,Format
418,"The atmosphere at a full cricket ground is electric and creates unforgettable memories, also the atmosphere of a full house at Lord's is unmatched in cricket",R418,2024-02-11 10:46:33,Experience
419,"The atmosphere during a World Cup final is indescribable, also the World Cup is the ultimate stage for any cricketer representing their nation",R419,2024-02-11 11:14:07,Tournament
420,The tactical battle between captain and opposition fascinates me. the tactical use of the new ball can determine the outcome of a match,R420,2024-02-11 11:18:13,Strategy
421,"Truthfully, cricket has given me some of my closest friendships and fondest memories",R421,2024-02-11 11:45:59,Personal
422,The excitement of a super over finish captures everything great about T20 in general,R422,2024-02-11 12:27:44,T20
423,idk,R423,2024-02-11 13:06:31,Batting
424,"I mean, the ICC needs to do more to support cricket in emerging nations",R424,2024-02-11 13:42:44,Governance
425,"Overall, cricket provides a healthy outlet for competitive instincts honestly",R425,2024-02-11 14:09:53,Personal
426,"Cricket's gentle pace allows for appreciation of individual battles within the team context, also the tension of a close Test match is incomparable to any other sporting experience all in all",R426,2024-02-11 14:28:39,Experience
427,nothing to add,R427,2024-02-11 15:11:50,Bowling
428,The tactical battle in a Test match can shift multiple times across five days to be honest,R428,2024-02-11 15:28:56,Strategy
429,"Truthfully, the Ashes series represents the pinnacle of cricket tradition and sporting heritage",R429,2024-02-11 15:57:21,Tournament
430,"Overall, cricket has given me some of my closest friendships and fondest memories",R430,2024-02-11 16:29:48,Personal
431,"Looking back, a perfectly timed cover drive is the most elegant shot in cricket",R431,2024-02-11 16:40:14,Batting
432,"The tactical battle between captain and opposition fascinates me, also the tactical use of the new ball can determine the outcome of a match in my opinion",R432,2024-02-11 17:12:15,Strategy
433,fine,R433,2024-02-11 17:38:06,Rivalry
434,"Cricket statistics help us appreciate performances across different eras. Additionally, the statistical depth of cricket appeals to analytically minded fans tbh",R434,2024-02-11 17:56:18,Statistics
435,"A perfectly timed cover drive is the most elegant shot in cricket, also building an innings in Test cricket is a lost art that needs revival",R435,2024-02-11 18:00:00,Batting
436,LOCAL CRICKET CLUBS FORM THE FOUNDATION OF THE SPORT'S DEVELOPMENT PYRAMID - THE CAMARADERIE IN CRICKET DRESSING ROOMS CREATES LIFELONG FRIENDSHIPS,R436,2024-02-11 18:32:55,Community
437,"To be honest, cricket has provided me with lifelong friendships and cherished memories tbh",R437,2024-02-11 19:07:39,Personal
438,"Overall, cricket's slow pace allows for detailed analysis and appreciation of subtlety. Additionally, the experience of playing cricket at iconic venues is something special",R438,2024-02-11 19:26:39,Experience
439,"I have to say, cricket provides opportunities for players from disadvantaged backgrounds",R439,2024-02-11 19:39:49,Social
440,Cricket commentary has evolved with more analysis and entertainment value if I'm being honest,R440,2024-02-11 20:00:51,Media
441,Cricket has a unique ability to bring together people from diverse backgrounds. watching cricket with knowledgeable fans enhances the viewing experience,R441,2024-02-11 20:05:51,Community
442,Cricket commentary has evolved with more analysis and entertainment value and cricket commentary should balance entertainment with insightful analysis for sure,R442,2024-02-11 20:18:25,Media
443,"Overall, the evolution of protective equipment has made batting safer but changed techniques in my opinion",R443,2024-02-11 20:58:12,Equipment
444,Watching cricket with knowledgeable fans enhances the viewing experience - the community aspect of club cricket brings people together across generations,R444,2024-02-11 21:39:31,Community
445,"The passion for cricket in the Indian subcontinent is extraordinary. Additionally, cricket brings out both the best and worst in terms of crowd behavior",R445,2024-02-11 21:56:46,Culture
446,The art of building partnerships is fundamental to successful batting but a perfectly timed cover drive is the most elegant shot in cricket,R446,2024-02-11 22:26:51,Batting
447,The emergence of franchise cricket has changed player priorities significantly and the Big Bash League has successfully attracted casual fans to the sport really,R447,2024-02-11 23:08:33,T20
448,Cricket's global calendar needs better coordination between boards overall,R448,2024-02-11 23:44:12,Governance
449,"Local cricket leagues provide valuable competitive experience for aspiring players. Additionally, the County Championship remains the bedrock of English cricket development",R449,2024-02-12 00:04:49,Domestic
450,"Playing cricket has taught me more about myself than any other activity, also cricket has given me a framework for understanding team dynamics",R450,2024-02-12 00:18:50,Personal
451,The quality of pitches significantly impacts the balance between bat and ball. playing conditions should favor a fair contest between bat and ball,R451,2024-02-12 00:31:32,Conditions
452,"In all honesty, cricket provides opportunities for players from disadvantaged backgrounds and cricket needs to be more accessible to people from all socioeconomic backgrounds",R452,2024-02-12 00:59:26,Social
453,meh,R453,2024-02-12 01:24:33,Community
454,The tactical awareness required in cricket develops with experience and study - the tactical use of the new ball can determine the outcome of a match,R454,2024-02-12 01:58:17,Strategy
455,The mental game in cricket is as important as physical skills overall,R455,2024-02-12 02:22:45,Psychology
456,"I HAVE TO SAY, CRICKET'S SLOW PACE ALLOWS FOR DETAILED ANALYSIS AND APPRECIATION OF SUBTLETY",R456,2024-02-12 02:52:00,Experience
457,Cricket has helped me develop long-term thinking and strategic planning overall,R457,2024-02-12 03:03:02,Personal
458,"The Ranji Trophy remains India's most prestigious domestic competition. Additionally, the quality of first-class cricket varies significantly between nations",R458,2024-02-12 03:07:48,Domestic
459,The spirit of cricket should prioritize fair play over gamesmanship and sledging honestly,R459,2024-02-12 03:29:06,Spirit
460,THE ROLE OF THE ALL-ROUNDER HAS BECOME INCREASINGLY VALUED IN MODERN CRICKET,R460,2024-02-12 03:56:19,Skills
461,satisfactory,R461,2024-02-12 04:21:00,Governance
462,"The excitement of a new innings starting brings fresh hope and possibilities. Additionally, the atmosphere of a full house at Lord's is unmatched in cricket",R462,2024-02-12 04:44:36,Experience
463,"Truthfully, spin bowling requires exceptional control patience and the ability to read batsmen, also the art of swing bowling seems to be declining in modern cricket",R463,2024-02-12 04:52:41,Bowling
464,Modern umpiring technology has improved decision accuracy significantly,R464,2024-02-12 05:30:18,Technology
465,The sense of belonging to a cricket club extends beyond just playing but local cricket clubs struggle with declining participation and funding,R465,2024-02-12 06:07:36,Community
466,Local cricket clubs form the foundation of the sport's development pyramid in general,R466,2024-02-12 06:47:23,Community
467,"TO BE HONEST, WOMEN'S CRICKET HAS GROWN TREMENDOUSLY AND DESERVES EQUAL RECOGNITION AND SUPPORT REALLY",R467,2024-02-12 07:21:42,Development
468,The emergence of cricket in non-traditional markets shows the sport's potential but the emergence of Afghan cricket has been remarkable given the country's challenges,R468,2024-02-12 07:37:48,Development
469,The economic impact of major cricket tournaments benefits local communities I think,R469,2024-02-12 08:01:25,Business
470,The rivalry between Australia and England defines the sport's heritage in general,R470,2024-02-12 08:33:42,Rivalry
471,Cricket boards need enhanced governance and transparency in decision-making,R471,2024-02-12 08:39:06,Governance
472,"The emergence of Afghan cricket has been remarkable given the country's challenges, also the emergence of associate nations has added depth to world cricket all in all",R472,2024-02-12 09:06:19,Development
473,Cricket has helped me develop resilience and handle pressure situations and cricket has given me a framework for understanding team dynamics,R473,2024-02-12 09:14:36,Personal
474,The quality of first-class cricket varies significantly between nations overall,R474,2024-02-12 09:32:57,Domestic
475,"Honestly, the variation in bowling speeds and lengths keeps batsmen guessing",R475,2024-02-12 09:50:59,Bowling
476,THE ICC NEEDS TO DO MORE TO SUPPORT CRICKET IN EMERGING NATIONS,R476,2024-02-12 10:27:57,Governance
477,The tactical awareness required in cricket develops with experience and study and the strategic nuances of field placements fascinate me as a cricket fan for sure,R477,2024-02-12 11:13:11,Strategy
478,CRICKET HAS HELPED MANY PLAYERS DEVELOP CONFIDENCE AND LEADERSHIP SKILLS,R478,2024-02-12 11:39:42,Personal
479,THE RIVALRY BETWEEN AUSTRALIA AND ENGLAND DEFINES THE SPORT'S HERITAGE,R479,2024-02-12 11:51:07,Rivalry
480,Cricket teaches the value of patience in an increasingly impatient world but playing cricket taught me valuable lessons about teamwork and sportsmanship,R480,2024-02-12 11:54:28,Values
481,"IN MY EXPERIENCE, TEST MATCH CRICKET PROVIDES THE ULTIMATE EXAMINATION OF TECHNIQUE AND TEMPERAMENT TO BE HONEST",R481,2024-02-12 12:00:53,Format
482,Cricket has given me some of my closest friendships and fondest memories - cricket has given me a framework for understanding team dynamics,R482,2024-02-12 12:46:44,Personal
483,"Honestly, cricket's colonial history creates complex dynamics in international competition",R483,2024-02-12 12:58:36,History
484,Cricket grounds with character and history provide unique playing experiences and the atmosphere at regional cricket matches can be incredibly passionate honestly,R484,2024-02-12 13:10:52,Experience
485,Test cricket should maintain its five-day format despite commercial pressures to be honest,R485,2024-02-12 13:14:58,Tradition
486,Cricket brings communities together during major international tournaments - cricket has a unique ability to bring together people from diverse backgrounds if I'm being honest,R486,2024-02-12 13:32:19,Community
487,Playing cricket has taught me more about myself than any other activity tbh,R487,2024-02-12 13:53:16,Personal
488,CRICKET'S TRADITIONS SHOULD EVOLVE NATURALLY RATHER THAN BE ARTIFICIALLY PRESERVED. THE TRADITION OF TEA INTERVALS ADDS TO CRICKET'S UNIQUE CHARM,R488,2024-02-12 14:37:45,Tradition
489,The growth of women's cricket has been one of the sport's great success stories but former players bring invaluable insights to coaching and development,R489,2024-02-12 15:11:38,Development
490,Cricket has produced some of the greatest sporting rivalries in history. the rivalry between Australia and England defines the sport's heritage,R490,2024-02-12 15:24:48,Rivalry
491,Cricket has a unique ability to bring together people from diverse backgrounds in general,R491,2024-02-12 15:47:59,Community
492,"From my perspective, the rivalry between subcontinent teams creates unparalleled passion, also the India-Pakistan rivalry is unmatched in sporting intensity and passion",R492,2024-02-12 16:00:15,Rivalry
493,Cricket's colonial history adds complex layers to international rivalries - cricket's colonial history creates complex dynamics in international competition really,R493,2024-02-12 16:42:59,History
494,LOCAL CRICKET CLUBS STRUGGLE WITH DECLINING PARTICIPATION AND FUNDING - CRICKET BRINGS COMMUNITIES TOGETHER DURING MAJOR INTERNATIONAL TOURNAMENTS,R494,2024-02-12 16:48:36,Community
495,"Overall, cricket teaches the value of patience in an increasingly impatient world really",R495,2024-02-12 17:19:14,Values
496,Cricket has produced iconic moments that transcend the sport itself. the legacy of great players inspires new generations to take up the sport in my opinion,R496,2024-02-12 18:03:38,History
497,"I gotta say, the World Cup is the ultimate stage for any cricketer representing their nation - the Ashes series represents the pinnacle of cricket tradition and sporting heritage",R497,2024-02-12 18:47:20,Tournament
498,The India-Pakistan rivalry is unmatched in sporting intensity and passion for sure,R498,2024-02-12 19:31:39,Rivalry
499,The physical demands on modern cricketers require rigorous fitness regimes overall,R499,2024-02-12 19:54:09,Fitness
500,Young players need more exposure to red-ball cricket to develop properly. cricket's global expansion to new markets is essential for the sport's future,R500,2024-02-12 20:11:17,Development
501,The physical demands on modern cricketers require rigorous fitness regimes in general,R501,2024-02-12 20:31:29,Fitness
502,The commercialization of cricket has both positive and negative consequences for sure,R502,2024-02-12 20:59:46,Business
503,The tactical use of the new ball can determine the outcome of a match - the tactical battle between captain and opposition fascinates me,R503,2024-02-12 21:43:45,Strategy
504,"To be honest, the atmosphere during a World Cup final is indescribable - the Ashes series represents the pinnacle of cricket tradition and sporting heritage",R504,2024-02-12 22:05:18,Tournament
505,Cricket boards need better governance and transparency in decision-making - the financial disparity between cricket boards threatens the sport's competitive balance,R505,2024-02-12 22:25:34,Governance
506,alright,R506,2024-02-12 23:06:47,Strategy
507,Investment in women's cricket is beginning to show results at the highest level in general,R507,2024-02-12 23:27:30,Development
508,"To be honest, the rivalry between bat and ball makes every delivery an individual contest",R508,2024-02-12 23:50:32,Competition
509,Cricket's long matches allow for natural ebbs and flows that shorter sports lack and limited overs cricket has produced some of the most thrilling finishes in sporting history I think,R509,2024-02-13 00:14:39,Format
510,"The experience of watching cricket live is far superior to television, also cricket's long matches create unique opportunities for comebacks and drama",R510,2024-02-13 00:42:45,Experience
511,"From my perspective, the Big Bash League has successfully attracted casual fans to the sport",R511,2024-02-13 01:06:07,T20
512,CRICKET HAS HELPED ME DEVELOP LONG-TERM THINKING AND STRATEGIC PLANNING AND CRICKET HAS HELPED ME DEVELOP RESILIENCE AND HANDLE PRESSURE SITUATIONS,R512,2024-02-13 01:28:27,Personal
513,"Basically, the legacy of great players inspires new generations to take up the sport",R513,2024-02-13 01:59:10,History
514,"In my experience, the tactical battle in a Test match can shift multiple times across five days",R514,2024-02-13 02:39:57,Strategy
515,"All things considered, the emergence of franchise cricket has changed player priorities significantly",R515,2024-02-13 03:00:46,T20
516,"In all honesty, cricket academies are developing talent earlier than ever before",R516,2024-02-13 03:32:40,Development
517,"Looking back, the development of switch-hitting has added new dimensions to batting and night Tests have added a new dimension to traditional cricket",R517,2024-02-13 04:03:20,Innovation
518,The tactical battle between bowling attacks and batting lineups is fascinating - the tactical battle in a Test match can shift multiple times across five days,R518,2024-02-13 04:30:49,Strategy
519,Modern batsmen struggle against quality spin bowling compared to previous generations - the role of the all-rounder has become increasingly valued in modern cricket,R519,2024-02-13 04:40:11,Skills
520,"In my experience, modern batsmen struggle against quality spin bowling compared to previous generations",R520,2024-02-13 05:07:52,Skills
521,"Truthfully, cricket has a unique ability to bring together people from diverse backgrounds - cricket brings communities together during major international tournaments",R521,2024-02-13 05:46:50,Community
522,The Ashes series represents the pinnacle of cricket tradition and sporting heritage and the atmosphere during a World Cup final is indescribable,R522,2024-02-13 06:31:32,Tournament
523,"Cricket has produced friendships across national boundaries and rivalries. Additionally, the bond between cricket teammates often lasts long after playing days end",R523,2024-02-13 07:13:13,Relationships
524,THE EVOLUTION OF PROTECTIVE EQUIPMENT HAS MADE BATTING SAFER BUT CHANGED TECHNIQUES,R524,2024-02-13 07:19:56,Equipment
525,Cricket teaches you to respect your opponents while competing fiercely but playing cricket taught me valuable lessons about teamwork and sportsmanship,R525,2024-02-13 07:41:45,Values
526,"Truthfully, modern coaching has transformed how players approach fitness and mental preparation. Additionally, the growth of women's cricket has been one of the sport's great success stories",R526,2024-02-13 08:24:41,Development
527,Cricket commentary has become too focused on entertainment over analysis. women's cricket coverage has improved dramatically in recent years tbh,R527,2024-02-13 08:32:48,Media
528,Cricket boards need better governance and transparency in decision-making. the ICC needs to do more to support cricket in emerging nations,R528,2024-02-13 08:42:09,Governance
529,Cricket's colonial history creates complex dynamics in international competition to be honest,R529,2024-02-13 09:19:24,History
530,"Looking back, playing conditions should favor a fair contest between bat and ball",R530,2024-02-13 09:46:20,Conditions
531,"To be honest, test cricket demands sustained concentration that other formats don't require tbh",R531,2024-02-13 09:50:33,Format
532,"In my experience, the pressure of a five-day Test match reveals true character and temperament",R532,2024-02-13 10:03:27,Psychology
533,Cricket has helped me develop resilience and handle pressure situations but playing cricket has helped me develop leadership and communication skills,R533,2024-02-13 10:43:45,Personal
534,The tradition of tea intervals adds to cricket's unique charm and test cricket should maintain its five-day format despite commercial pressures,R534,2024-02-13 10:57:31,Tradition
535,"To be honest, cricket's long matches allow for natural ebbs and flows that shorter sports lack. Additionally, test match cricket provides the ultimate examination of technique and temperament",R535,2024-02-13 11:33:22,Format
536,Cricket's somewhat long matches allow for natural ebbs and flows that shorter sports lack,R536,2024-02-13 11:55:41,Format
537,ok,R537,2024-02-13 12:31:02,Personal
538,The rotation of strike in limited overs cricket requires intelligent running and the role of the all-rounder has become increasingly valued in modern cricket,R538,2024-02-13 12:55:12,Skills
539,Cricket brings out both the best and worst in terms of crowd behavior and the passion of cricket fans in South Asia is unmatched anywhere in the world,R539,2024-02-13 13:32:11,Culture
540,Playing cricket taught me valuable lessons about teamwork and sportsmanship honestly,R540,2024-02-13 14:01:34,Values
541,Women's cricket coverage has improved dramatically in recent years - cricket commentary has become too focused on entertainment over analysis,R541,2024-02-13 14:19:30,Media
542,The tactical use of the new ball can determine the outcome of a match honestly,R542,2024-02-13 14:47:08,Strategy
543,Cricket's global calendar needs stronger coordination between boards,R543,2024-02-13 15:11:22,Governance
544,"To be honest, watching cricket with knowledgeable fans enhances the viewing experience",R544,2024-02-13 15:15:51,Community
545,"Honestly, night Tests have added a new dimension to traditional cricket",R545,2024-02-13 15:34:50,Innovation
546,The complexity of cricket rules can be daunting for new fans all in all,R546,2024-02-13 15:43:22,Accessibility
547,WATCHING CRICKET WITH KNOWLEDGEABLE FANS ENHANCES THE VIEWING EXPERIENCE - WATCHING CRICKET WITH FAMILY HAS CREATED CHERISHED CHILDHOOD MEMORIES,R547,2024-02-13 16:05:36,Community
548,Modern umpiring technology has improved decision accuracy significantly but the emergence of data-driven selection policies has changed team management,R548,2024-02-13 16:11:25,Technology
549,The importance of a solid defensive technique is often undervalued in modern cricket but batting in challenging conditions separates great players from good ones,R549,2024-02-13 16:30:55,Batting
550,Spin bowling requires exceptional control patience and the ability to read batsmen - wrist spin bowling is experiencing a welcome renaissance in modern cricket,R550,2024-02-13 16:44:39,Bowling
551,The variety of shots in a batsman's repertoire reflects years of practice really,R551,2024-02-13 17:12:40,Skills
552,"Looking back, cricket grounds with character and history provide unique playing experiences",R552,2024-02-13 17:52:49,Experience
553,A PERFECTLY TIMED COVER DRIVE IS THE MOST ELEGANT SHOT IN CRICKET BUT THE ART OF BUILDING PARTNERSHIPS IS FUNDAMENTAL TO SUCCESSFUL BATTING,R553,2024-02-13 18:26:37,Batting
554,"FROM MY PERSPECTIVE, THE EXPERIENCE OF PLAYING CRICKET AT ICONIC VENUES IS SOMETHING SPECIAL",R554,2024-02-13 19:11:27,Experience
555,Local cricket clubs are the foundation of the sport's grassroots development - local cricket clubs form the foundation of the sport's development pyramid,R555,2024-02-13 19:51:43,Community
556,The variety of shots in a batsman's repertoire reflects years of practice I think,R556,2024-02-13 20:04:38,Skills
557,The World Cup is the ultimate stage for any cricketer representing their nation to be honest,R557,2024-02-13 20:50:07,Tournament
558,Pink ball Tests have shown promise in attracting evening crowds and the development of switch-hitting has added new dimensions to batting,R558,2024-02-13 21:27:55,Innovation
559,Young players need mentorship from experienced cricketers to develop properly but the emergence of cricket in non-traditional markets shows the sport's potential,R559,2024-02-13 22:02:05,Development
560,"Overall, watching a spinner turn the ball sharply never gets old. pace bowlers today are stronger and faster than ever before",R560,2024-02-13 22:20:52,Bowling
561,The role of the third umpire has become increasingly important in modern cricket. the role of data analytics in cricket strategy has transformed team preparation,R561,2024-02-13 22:51:20,Technology
562,Cricket development programs need sustained funding and commitment honestly,R562,2024-02-13 23:23:59,Development
