id,response,respondent_id,timestamp,topic
226,The atmosphere at regional cricket matches can be incredibly passionate I think,R226,2024-02-07 22:39:42,Experience
227,The role of the captain in cricket is more significant than in most team sports honestly,R227,2024-02-07 23:08:51,Leadership
228,not bad,R228,2024-02-07 23:13:54,Psychology
229,"The tradition of tea intervals adds to cricket's unique charm. Additionally, cricket's traditions should be preserved while embracing necessary innovation overall",R229,2024-02-07 23:39:47,Tradition
230,The emergence of franchise cricket has changed player priorities significantly - the Hundred format is an interesting experiment to attract new audiences,R230,2024-02-07 23:53:38,T20
231,"Looking back, the unpredictability of weather in Test cricket adds an extra strategic element",R231,2024-02-08 00:22:14,Conditions
232,"Basically, cricket statistics provide fascinating depth and context to player performances",R232,2024-02-08 00:33:06,Statistics
233,"Truthfully, the psychological battle between bowler and batsman is endlessly fascinating overall",R233,2024-02-08 00:47:15,Psychology
234,The physical demands on modern cricketers require rigorous fitness regimes tbh,R234,2024-02-08 01:06:20,Fitness
235,fine nothing special,R235,2024-02-08 01:33:04,Experience
236,"From my perspective, the tactical battle in a Test match can shift multiple times across five days",R236,2024-02-08 01:46:54,Strategy
237,"All things considered, match-fixing scandals have damaged cricket's integrity and trust with fans honestly",R237,2024-02-08 02:32:09,Integrity
238,Cricket teaches children discipline patience and respect for opponents tbh,R238,2024-02-08 03:15:49,Values
239,"Cricket administrators must balance tradition with necessary modernization. Additionally, cricket boards need better governance and transparency in decision-making",R239,2024-02-08 03:34:57,Governance
240,Cricket's slow pace allows for detailed analysis and appreciation of subtlety all in all,R240,2024-02-08 04:14:02,Experience
241,"Truthfully, modern batting techniques have evolved to counter specific bowling threats",R241,2024-02-08 04:24:43,Batting
242,The atmosphere at regional cricket matches can be incredibly passionate all in all,R242,2024-02-08 04:43:20,Experience
243,"I gotta say, building an innings in Test cricket is a lost art that needs revival in general",R243,2024-02-08 05:06:00,Batting
244,"Local cricket clubs are the foundation of the sport's grassroots development. Additionally, the camaraderie in cricket dressing rooms creates lifelong friendships",R244,2024-02-08 05:12:31,Community
245,The emergence of cricket in non-traditional markets shows the sport's potential. cricket in schools is essential for developing future players and fans,R245,2024-02-08 05:32:16,Development
246,"I have to say, t20 cricket has made the sport more exhilarating but sometimes sacrifices technique for entertainment",R246,2024-02-08 06:06:18,T20
247,The mental strength to recover from poor form separates great players - the psychological battle between bowler and batsman is endlessly fascinating,R247,2024-02-08 06:21:42,Psychology
248,Cricket commentary should balance entertainment with insightful analysis - radio commentary paints pictures that television cannot replicate,R248,2024-02-08 07:02:43,Media
249,"I mean, the atmosphere at regional cricket matches can be incredibly passionate",R249,2024-02-08 07:24:11,Experience
250,"I have to say, the passion for cricket in the Indian subcontinent is extraordinary overall",R250,2024-02-08 08:00:38,Culture
251,"Fast bowling is an art form that combines athleticism skill and intimidation, also watching a spinner turn the ball sharply never gets old",R251,2024-02-08 08:29:50,Bowling
252,whatever,R252,2024-02-08 09:04:43,Experience
253,"Night Tests have added a new dimension to traditional cricket, also the development of switch-hitting has added new dimensions to batting for sure",R253,2024-02-08 09:21:17,Innovation
254,"The mental strength to recover from poor form separates great players, also the mental fortitude required to bat for a full day is extraordinary",R254,2024-02-08 09:31:54,Psychology
255,"From my perspective, cricket has produced some of the greatest sporting rivalries in history",R255,2024-02-08 10:11:53,Rivalry
256,"The India-Pakistan rivalry is unmatched in sporting intensity and passion, also cricket has produced some of the greatest sporting rivalries in history",R256,2024-02-08 10:19:32,Rivalry
257,TEST MATCH CRICKET PROVIDES THE ULTIMATE EXAMINATION OF TECHNIQUE AND TEMPERAMENT,R257,2024-02-08 10:33:57,Format
258,The excitement of a super over finish captures everything great about T20 but the Hundred format is an interesting experiment to attract new audiences,R258,2024-02-08 11:06:53,T20
259,The social aspect of village cricket is as important as the game itself and local cricket clubs form the foundation of the sport's development pyramid,R259,2024-02-08 11:19:08,Community
260,"In my experience, playing cricket has helped me develop leadership and communication skills",R260,2024-02-08 12:00:08,Personal
261,"In my experience, the bond between cricket teammates often lasts long after playing days end if I'm being honest",R261,2024-02-08 12:26:03,Relationships
262,"Looking back, cricket academies are developing talent earlier than ever before if I'm being honest",R262,2024-02-08 12:58:06,Development
263,Batting in challenging conditions separates great players from pleasant ones,R263,2024-02-08 13:28:49,Batting
264,"THE CAMARADERIE IN CRICKET DRESSING ROOMS CREATES LIFELONG FRIENDSHIPS. ADDITIONALLY, THE SENSE OF BELONGING TO A CRICKET CLUB EXTENDS BEYOND JUST PLAYING",R264,2024-02-08 14:11:15,Community
265,THE UNPREDICTABILITY OF CRICKET ON DIFFERENT SURFACES KEEPS THE GAME FASCINATING,R265,2024-02-08 14:45:49,Conditions
266,Modern umpiring technology has improved decision accuracy significantly. modern technology has revealed the complexity of bowling actions,R266,2024-02-08 15:23:32,Technology
267,The role of the all-rounder has become increasingly valued in modern cricket and modern batsmen struggle against quality spin bowling compared to previous generations,R267,2024-02-08 15:48:09,Skills
268,"From my perspective, the role of the captain in cricket is more significant than in most team sports",R268,2024-02-08 16:33:02,Leadership
269,"I have to say, the quality of pitches significantly impacts the balance between bat and ball",R269,2024-02-08 17:12:28,Conditions
270,"In my experience, cricket's appeal lies in its combination of individual excellence and team success all in all",R270,2024-02-08 17:22:00,Values
271,Cricket's traditions should evolve naturally rather than be artificially preserved but cricket's traditions should be preserved while embracing necessary innovation,R271,2024-02-08 17:41:03,Tradition
272,Cricket's global calendar needs superior coordination between boards,R272,2024-02-08 17:49:58,Governance
273,The rivalry between subcontinent teams creates unparalleled passion - the rivalry between India and Australia has produced memorable series,R273,2024-02-08 18:22:41,Rivalry
274,ok I guess,R274,2024-02-08 18:28:53,Community
275,"I gotta say, the sound of leather on willow is one of the most satisfying sounds in sport",R275,2024-02-08 19:01:19,Experience
276,CRICKET HAS HELPED ME DEVELOP RESILIENCE AND HANDLE PRESSURE SITUATIONS,R276,2024-02-08 19:29:33,Personal
277,Watching cricket with knowledgeable fans enhances the viewing experience but local cricket clubs are the foundation of the sport's grassroots development,R277,2024-02-08 19:55:49,Community
278,The camaraderie in cricket dressing rooms creates lifelong friendships in my opinion,R278,2024-02-08 20:19:30,Community
279,Playing cricket overseas broadens perspectives and builds global connections. cricket brings out both the best and worst in terms of crowd behavior,R279,2024-02-08 20:37:40,Culture
280,Cricket provides opportunities for players from disadvantaged backgrounds and cricket needs to address issues of inclusivity and diversity more actively,R280,2024-02-08 20:54:49,Social
281,"In my experience, wrist spin bowling is experiencing a welcome renaissance in modern cricket",R281,2024-02-08 21:34:45,Bowling
282,"In my experience, the standard of catching in international cricket has improved dramatically",R282,2024-02-08 21:54:39,Skills
283,"From my perspective, the Ranji Trophy remains India's most prestigious domestic competition",R283,2024-02-08 22:00:09,Domestic
284,The passion of cricket fans in South Asia is unmatched anywhere in the world - the passion for cricket in the Indian subcontinent is extraordinary,R284,2024-02-08 22:31:05,Culture
285,Cricket boards need superior governance and transparency in decision-making,R285,2024-02-08 23:03:28,Governance
286,"I gotta say, cricket brings out both the best and worst in terms of crowd behavior",R286,2024-02-08 23:20:21,Culture
287,"Overall, spin bowling requires exceptional control patience and the ability to read batsmen",R287,2024-02-08 23:56:22,Bowling
288,"I gotta say, the atmosphere during a World Cup final is indescribable",R288,2024-02-09 00:42:17,Tournament
289,"Truthfully, cricket teaches the importance of playing within the rules while competing hard, also cricket's appeal lies in its combination of individual excellence and team success",R289,2024-02-09 00:54:17,Values
290,"Truthfully, cricket commentary should balance entertainment with insightful analysis",R290,2024-02-09 01:24:53,Media
291,THE TACTICAL AWARENESS REQUIRED IN CRICKET DEVELOPS WITH EXPERIENCE AND STUDY,R291,2024-02-09 02:01:05,Strategy
292,The role of the third umpire has become increasingly vital in modern cricket,R292,2024-02-09 02:15:36,Technology
293,Modern umpiring technology has improved decision accuracy significantly but dRS technology has improved decision-making but sometimes takes away from the human element,R293,2024-02-09 03:00:17,Technology
294,"I mean, the financial disparity between cricket boards threatens the sport's competitive balance",R294,2024-02-09 03:23:27,Governance
295,Women's cricket coverage has improved dramatically in recent years in general,R295,2024-02-09 03:40:12,Media
296,Test cricket needs innovation to remain relevant to younger audiences all in all,R296,2024-02-09 04:15:30,Format
297,Playing cricket in different conditions teaches adaptability and resilience in general,R297,2024-02-09 04:50:01,Personal
298,The passion of cricket fans in South Asia is unmatched anywhere in the world in general,R298,2024-02-09 05:25:04,Culture
299,"Cricket's colonial history creates complex dynamics in international competition. Additionally, cricket has produced iconic moments that transcend the sport itself",R299,2024-02-09 05:52:36,History
300,"In all honesty, cricket has produced some of the greatest sporting rivalries in history. Additionally, the rivalry between subcontinent teams creates unparalleled passion",R300,2024-02-09 06:19:58,Rivalry
301,"Honestly, cricket's appeal lies in its combination of individual excellence and team success I think",R301,2024-02-09 06:56:05,Values
302,The transformation of fielding standards has raised the overall level of cricket and the role of the wicketkeeper has evolved with new batting demands honestly,R302,2024-02-09 07:28:15,Skills
303,"Honestly, cricket statistics help us appreciate performances across different eras. cricket statistics provide fascinating depth and context to player performances in general",R303,2024-02-09 07:43:03,Statistics
304,A PERFECTLY TIMED COVER DRIVE IS THE MOST ELEGANT SHOT IN CRICKET AND THE IMPORTANCE OF ROTATING STRIKE IN LIMITED OVERS IS OFTEN UNDERESTIMATED,R304,2024-02-09 08:22:44,Batting
305,Cricket statistics provide fascinating depth and context to player performances honestly,R305,2024-02-09 08:41:36,Statistics
306,"In all honesty, cricket's ability to produce draws adds a unique strategic dimension, also limited overs cricket has produced some of the most thrilling finishes in sporting history",R306,2024-02-09 08:58:20,Format
307,"To be honest, the Ranji Trophy remains India's most prestigious domestic competition if I'm being honest",R307,2024-02-09 09:32:35,Domestic
308,"All things considered, the emergence of associate nations has added depth to world cricket, also cricket's global reach continues to expand into new territories",R308,2024-02-09 10:01:56,Development
309,I'D SAY THAT PLAYING CRICKET HAS HELPED ME DEVELOP LEADERSHIP AND COMMUNICATION SKILLS,R309,2024-02-09 10:40:15,Personal
310,Cricket grounds with historical significance provide a unique atmosphere honestly,R310,2024-02-09 10:50:32,Experience
311,Test cricket is the purest form of the game requiring resilience strategy and mental strength over five days honestly,R311,2024-02-09 11:17:27,Format
312,Playing cricket overseas broadens perspectives and builds global connections and the passion for cricket in the Indian subcontinent is extraordinary,R312,2024-02-09 11:33:37,Culture
313,"Basically, young players need mentorship from experienced cricketers to develop properly",R313,2024-02-09 11:38:30,Development
314,The tactical battle in a Test match can shift multiple times across five days and the tactical battle between captain and opposition fascinates me,R314,2024-02-09 12:11:00,Strategy
315,Cricket teaches the importance of playing within the rules while competing hard to be honest,R315,2024-02-09 12:54:18,Values
316,Playing conditions that favor one side excessively damage the sport's credibility to be honest,R316,2024-02-09 13:32:49,Fairness
317,"From my perspective, the atmosphere at a full cricket ground is electric and creates unforgettable memories",R317,2024-02-09 14:05:56,Experience
318,The Ranji Trophy remains India's most prestigious domestic competition. the County Championship remains the bedrock of English cricket development,R318,2024-02-09 14:31:15,Domestic
319,"The mental fortitude required to bat for a full day is extraordinary. Additionally, the pressure of a five-day Test match reveals true character and temperament",R319,2024-02-09 15:13:16,Psychology
320,"Basically, radio commentary paints pictures that television cannot replicate really",R320,2024-02-09 15:26:09,Media
321,Watching cricket with family has created cherished childhood memories and the social aspect of village cricket is as important as the game itself,R321,2024-02-09 15:41:51,Community
322,"I gotta say, t20 cricket has made the sport more captivating but sometimes sacrifices technique for entertainment",R322,2024-02-09 15:49:22,T20
323,Batting in challenging conditions separates great players from satisfactory ones,R323,2024-02-09 16:27:29,Batting
324,The rotation of strike in limited overs cricket requires intelligent running,R324,2024-02-09 17:06:21,Skills
325,"From my perspective, a perfectly timed cover drive is the most elegant shot in cricket",R325,2024-02-09 17:51:16,Batting
326,"I mean, the complexity of cricket rules can be daunting for new fans",R326,2024-02-09 17:54:25,Accessibility
327,The emergence of data-driven selection policies has changed team management to be honest,R327,2024-02-09 18:32:13,Technology
328,"Test cricket teaches patience and perseverance unlike any other format. Additionally, test cricket is the purest form of the game requiring resilience strategy and mental strength over five days",R328,2024-02-09 18:56:25,Format
329,WOMEN'S CRICKET HAS GROWN TREMENDOUSLY AND DESERVES EQUAL RECOGNITION AND SUPPORT. THE EMERGENCE OF CRICKET IN NON-TRADITIONAL MARKETS SHOWS THE SPORT'S POTENTIAL,R329,2024-02-09 19:39:55,Development
330,"Overall, the pressure of a five-day Test match reveals true character and temperament, also the mental fortitude required to bat for a full day is extraordinary",R330,2024-02-09 20:05:26,Psychology
331,Wrist spin bowling is experiencing a welcome renaissance in modern cricket really,R331,2024-02-09 20:16:22,Bowling
332,"In all honesty, pace bowlers today are stronger and faster than ever before. the variation in bowling speeds and lengths keeps batsmen guessing",R332,2024-02-09 20:45:53,Bowling
333,The decline of traditional batting techniques concerns many cricket purists - modern batsmen struggle against quality spin bowling compared to previous generations,R333,2024-02-09 21:05:07,Skills
334,"IN MY EXPERIENCE, THE MENTAL STRENGTH REQUIRED FOR TEST CRICKET MAKES IT THE ULTIMATE EXAMINATION",R334,2024-02-09 21:41:48,Psychology
335,The passion of cricket fans in South Asia is unmatched anywhere in the world for sure,R335,2024-02-09 22:21:54,Culture
336,The mental strength required for Test cricket makes it the ultimate examination really,R336,2024-02-09 22:31:58,Psychology
337,"Cricket grounds with historical significance provide a unique atmosphere, also the atmosphere at a full cricket ground is electric and creates unforgettable memories",R337,2024-02-09 22:57:17,Experience
338,The experience of watching cricket live is far superior to television in general,R338,2024-02-09 23:20:54,Experience
339,The sense of belonging to a cricket club extends beyond just playing in my opinion,R339,2024-02-10 00:02:11,Community
340,"Cricket has helped many players develop confidence and leadership skills, also cricket has helped me develop long-term thinking and strategic planning in my opinion",R340,2024-02-10 00:22:08,Personal
341,Modern coaching has transformed how players approach fitness and mental preparation really,R341,2024-02-10 00:58:58,Development
342,"The camaraderie in cricket dressing rooms creates lifelong friendships. Additionally, local cricket creates social bonds that extend far beyond the playing field",R342,2024-02-10 01:18:34,Community
343,"Cricket brings families together on lazy summer afternoons. Additionally, the social aspect of village cricket is as important as the game itself",R343,2024-02-10 01:22:15,Community
344,Cricket provides a healthy outlet for competitive instincts but playing cricket in different conditions teaches adaptability and resilience,R344,2024-02-10 01:37:50,Personal
345,"In all honesty, the County Championship remains the bedrock of English cricket development - the Sheffield Shield has produced some of Australia's greatest cricketers",R345,2024-02-10 02:15:56,Domestic
346,Cricket commentary has become too focused on entertainment over analysis really,R346,2024-02-10 03:00:11,Media
347,Playing cricket in different conditions teaches adaptability and resilience. playing cricket has helped me develop leadership and communication skills,R347,2024-02-10 03:03:32,Personal
348,"Local derby matches create intense rivalries in domestic cricket. Additionally, the quality of first-class cricket varies significantly between nations",R348,2024-02-10 03:48:06,Domestic
349,The importance of rotating strike in limited overs is often underestimated in my opinion,R349,2024-02-10 04:02:56,Batting
350,"Looking back, the role of the wicketkeeper has evolved with new batting demands",R350,2024-02-10 04:16:10,Skills
351,"Truthfully, playing conditions that favor one side excessively damage the sport's credibility",R351,2024-02-10 04:24:27,Fairness
352,The India-Pakistan rivalry is unmatched in sporting intensity and passion in my opinion,R352,2024-02-10 04:46:02,Rivalry
353,"All things considered, the role of the wicketkeeper has evolved with new batting demands",R353,2024-02-10 04:53:32,Skills
354,"Young fast bowlers need better workload management to prevent injuries. Additionally, cricket needs to address issues of player burnout more seriously",R354,2024-02-10 05:12:15,Health
355,Cricket has helped me develop resilience and handle pressure situations. playing cricket builds character and teaches handling of adversity,R355,2024-02-10 05:38:51,Personal
356,The excitement of a new innings starting brings fresh hope and possibilities if I'm being honest,R356,2024-02-10 05:59:59,Experience
357,ok service,R357,2024-02-10 06:27:30,Personal
358,T20 cricket has made the sport more somewhat exciting but sometimes sacrifices technique for entertainment,R358,2024-02-10 06:30:44,T20
359,The quality of pitches significantly impacts the balance between bat and ball to be honest,R359,2024-02-10 07:08:44,Conditions
360,Watching replay analysis has deepened my understanding of the game really,R360,2024-02-10 07:49:13,Technology
361,"I mean, cricket provides opportunities for players from disadvantaged backgrounds",R361,2024-02-10 08:15:50,Social
362,"Looking back, watching a spinner turn the ball sharply never gets old",R362,2024-02-10 08:38:23,Bowling
363,I'd say that test cricket is the purest form of the game requiring resilience strategy and mental strength over five days but cricket's ability to produce draws adds a unique strategic dimension,R363,2024-02-10 09:22:11,Format
364,The spirit of cricket should prioritize fair play over gamesmanship and sledging overall,R364,2024-02-10 09:32:37,Spirit
365,Cricket statistics help us appreciate performances across different eras in general,R365,2024-02-10 09:45:55,Statistics
366,The variation in bowling speeds and lengths keeps batsmen guessing. spin bowling requires exceptional control patience and the ability to read batsmen,R366,2024-02-10 10:28:23,Bowling
367,The artistry of batting against spin on turning pitches is elegant to watch,R367,2024-02-10 10:42:49,Batting
368,Former players bring invaluable insights to coaching and development all in all,R368,2024-02-10 11:13:26,Development
369,"Truthfully, test cricket teaches patience and perseverance unlike any other format, also cricket's ability to produce draws adds a unique strategic dimension really",R369,2024-02-10 11:49:54,Format
370,Cricket has helped me develop resilience and handle pressure situations if I'm being honest,R370,2024-02-10 12:31:57,Personal
371,The Ashes series represents the pinnacle of cricket tradition and sporting heritage overall,R371,2024-02-10 12:53:10,Tournament
372,"In my experience, test cricket attendance has declined but television audiences remain strong for sure",R372,2024-02-10 13:35:48,Future
373,Cricket in schools is essential for developing future players and fans. former players bring invaluable insights to coaching and development all in all,R373,2024-02-10 14:07:43,Development
374,DRS technology has improved decision-making but sometimes takes away from the human element and the emergence of data-driven selection policies has changed team management,R374,2024-02-10 14:35:14,Technology
375,Cricket provides valuable life lessons about handling success and failure - cricket teaches the importance of playing within the rules while competing hard,R375,2024-02-10 15:07:19,Values
376,THE TACTICAL USE OF THE NEW BALL CAN DETERMINE THE OUTCOME OF A MATCH,R376,2024-02-10 15:50:15,Strategy
377,The Ranji Trophy remains India's most prestigious domestic competition but the County Championship remains the bedrock of English cricket development,R377,2024-02-10 16:31:52,Domestic
378,"In all honesty, cricket's ability to produce draws adds a unique strategic dimension, also test match cricket provides the ultimate examination of technique and temperament",R378,2024-02-10 17:14:10,Format
379,"Playing cricket taught me valuable lessons about teamwork and sportsmanship. Additionally, cricket's appeal lies in its combination of individual excellence and team success honestly",R379,2024-02-10 17:45:44,Values
380,I'd say that watching cricket with knowledgeable fans enhances the viewing experience,R380,2024-02-10 17:56:27,Community
381,"Night Tests have added a new dimension to traditional cricket. Additionally, the development of switch-hitting has added new dimensions to batting",R381,2024-02-10 18:39:26,Innovation
382,"In my experience, the complexity of cricket rules can be daunting for new fans really",R382,2024-02-10 19:21:59,Accessibility
383,"The variety of shots in a batsman's repertoire reflects years of practice, also the rotation of strike in limited overs cricket requires intelligent running",R383,2024-02-10 20:06:20,Skills
384,Reverse swing bowling is one of the most skillful arts in cricket in my opinion,R384,2024-02-10 20:21:15,Bowling
385,The role of the third umpire has become increasingly essential in modern cricket,R385,2024-02-10 20:26:17,Technology
386,Cricket needs to address issues of player burnout more seriously for sure,R386,2024-02-10 20:47:14,Health
387,Cricket has produced friendships across national boundaries and rivalries but the bond between cricket teammates often lasts long after playing days end,R387,2024-02-10 21:03:05,Relationships
388,Cricket provides a healthy outlet for competitive instincts,R388,2024-02-10 21:38:01,Personal
389,Playing cricket has taught me more about myself than any other activity honestly,R389,2024-02-10 22:04:19,Personal
390,The transformation of fielding standards has raised the overall level of cricket in my opinion,R390,2024-02-10 22:37:02,Skills
391,"All things considered, the camaraderie in cricket dressing rooms creates lifelong friendships",R391,2024-02-10 22:51:47,Community
392,The role of the captain in cricket is more significant than in most team sports all in all,R392,2024-02-10 23:03:40,Leadership
393,"ALL THINGS CONSIDERED, THE ROLE OF THE CAPTAIN IN CRICKET IS MORE SIGNIFICANT THAN IN MOST TEAM SPORTS",R393,2024-02-10 23:41:36,Leadership
394,"Looking back, the rivalry between bat and ball makes every delivery an individual contest",R394,2024-02-10 23:50:42,Competition
395,"To be honest, cricket teaches the importance of playing within the rules while competing hard",R395,2024-02-11 00:32:32,Values
396,"Cricket has helped many players develop confidence and leadership skills. Additionally, playing cricket in different conditions teaches adaptability and resilience",R396,2024-02-11 01:11:54,Personal
397,incredibly Fast bowling injuries remain a significant concern for player welfare,R397,2024-02-11 01:32:34,Health
