text,emotions,primary_emotion
Can you please write up a summary of how the event went? The live stream isn't working because they changed the venue. Thank you!,"curiosity, gratitude",curiosity
I heard [NAME] has a new puppy named One-Bridge-Havin,neutral,neutral
I noticed a lot of times racists just try to bait people so you did the right thing.,approval,approval
Have to admit I thought this story would end with her demanding food or something.,neutral,neutral
Dregs of society still the dregs of society shocker.,neutral,neutral
"""I'm not sure she says """"my"""", we'll have more occasions of hearing it again though :)""",neutral,neutral
Post this on /r/nba lol,amusement,amusement
[NAME] i really hate entitled people. Upvote if you think that EPs are worse than Antivaxxers.,"anger, disgust",anger
I dont see a blue line connecting them i see each mine has a little line coming out but on my screen they arent touching,neutral,neutral
OK. You’re not distinguishing yourself from an anti-theist. >[RELIGION] [NAME] I said ‘a god’.,neutral,neutral
[NAME] had them a few months ago. Friend bought some for her sick dog.,caring,caring
He’s not the character you’re looking for.,neutral,neutral
"yeah, there's even more registered online. scary.",fear,fear
"Hes been amazing, so good I've pondered about playing a 442 with [NAME] and him in the middle",admiration,admiration
She might just be bitter over her own relationship and this is a painful reminder in some way.,sadness,sadness
And happy cake day.,joy,joy
It’s rebranded as the ‘Quarter Note Hotel’. For now.,approval,approval
Lol loving these choose your own ending memes [NAME] 💕,"amusement, love",amusement
Couldn’t find my wallet for the last 4 days. This also happens to be an awesome way to not spend any money.,admiration,admiration
this is r/comedyheaven content alright. frick u i love it.,love,love
Me too. One of my favorite potential Dem candidates,love,love
"I was shocked. They were talking earlier on the news about her losing by less than 100 being a victory, of sorts.",surprise,surprise
Turn in them. Who cares if they’re your cousins. They’re not three years old. They should know better.,annoyance,annoyance
Or... Or you can eat mine.,neutral,neutral
I’m rather surprised that these books are STILL being made. Like I thought they died off around 2014.,surprise,surprise
Then leave him. You're not married and sexually comparability is a huge part of making a relationship work. Don't underestimate this my friend.,caring,caring
"Sorry to hear that, I have it for ps4 and hardcore dlc servers are still up",sadness,sadness
... that's inflatin' LAOP's frustration?,neutral,neutral
as an underweight couch potato I don’t relate to any of them.,neutral,neutral
Laughed right out loud 🤣,amusement,amusement
"Yeah, and the pushers can do that whether they're paid or not.",neutral,neutral
This is what I was looking for. I keep passing all the info up. I appreciate all the help!,gratitude,gratitude
ahhhhh no how dare i have morals of course the most important thing is that my favorite football team has a better special teams coordinator,joy,joy
He can’t be like that in that business but it already sounds too late. No wonder his staff quit on him.,disapproval,disapproval
Your company sucks.,"disgust, neutral",disgust
I would literally rather have the government throw $3k into a shredder than fund this shithead’s trip down south,"anger, annoyance, disapproval",anger
My mom does this all the time. I've always wondered why she feels the need to do it. Can you tell me why you do it?,curiosity,curiosity
"finally, a game to watch",neutral,neutral
See you all tomorrow for FIN - USA! End of the evening iguana,"optimism, neutral",optimism
"Brother, I am in tears, [NAME], I wish I had been there. ","desire, sadness",desire
"That's not really libertarianism, is it?",curiosity,curiosity
"Did the burglar win? It's fine and all that he tried sueing, if it actually worked is the important part. ",approval,approval
Have you ever consider knocking three times and that hide and seek/stalker vibe is terrifying. It's the most disturbing thing I can link you my AR 15.,annoyance,annoyance
The real [NAME] is always in the comments. Thank you internet stranger,gratitude,gratitude
Surely this particular one an extreme example? Thinking his brother is a lizard....,"confusion, curiosity",confusion
If this is real it’s just the best thing I’ve ever come across. I’m still crying laughing after 10 minutes!,amusement,amusement
How tf did the vaccine cause them to lose their jaw? This smells like BS,neutral,neutral
[NAME] will end up owning all these untouchable records and I hope they don’t get broken for generations,optimism,optimism
Am love u,love,love
I'm betting my life savings she makes it all the way through and gets a relative happy ending :),neutral,neutral
this is my new favourite thread,admiration,admiration
"""""""Help! It's an educated brown woman! Help meeeeee!""""""",sadness,sadness
Thank you. I'll definately be sure to pick up that book sometime.,gratitude,gratitude
Desktop link: ^^/r/HelperBot_ ^^Downvote ^^to ^^remove. ^^Counter: ^^229126,neutral,neutral
Kinda sad but... Okay then,sadness,sadness
I thought you were just going to wait her out. You actually engineered her loss of space to someone else. WELL DONE!!!!,admiration,admiration
A news source putting out sponsored news is inappropriate. Stop reading BBC i guess,"annoyance, disapproval",annoyance
Thins are my favorite and I will not apologize. It makes the flavor of the cookie shine through.,"love, optimism",love
That was something I was told as well. It makes sense. Thanks for verifying that as an option.,gratitude,gratitude
Ah it's the old one. First I can remember! Of course not the first. Or the last. Hard to keep track at times...,confusion,confusion
Everyone in the sub needs to watch this. Cousins can’t succeed with this line and it’s not what we paid him to do,neutral,neutral
"Do you feel like being with him is the only way for you to be okay, then?","confusion, curiosity",confusion
25 m from Canada! out for 10 years now! I'd love to make a new penpal!,love,love
"Their wings are great! Huge, well breaded and sauced, comes with a nice dill ranch dipping sauce. But expensive as hell... $14 for 6 wings",admiration,admiration
Great picture! What a amazing tribute! I love Dallas,"admiration, love",admiration
"That's the key- minor corrections, little improvements, something slightly different.",neutral,neutral
"The very best they could do was the uranium one unscandal, which even [NAME] had too much dignity to touch. ",neutral,neutral
"He burnt out. Give it some time. Other option is he never really cared, but I find that unlikely. Also maybe life just happened.","caring, disappointment",caring
"I played that one. It was really fun(at least to me, as a kid).",joy,joy
I isst thought y’all woooshed me but then I realized what subreddit I’m on,realization,realization
Same love our late 80s and early 90s Unis. When ever I used to play [NAME] I always played with throw back Unis due to helmet,neutral,neutral
Hmm...I'm very human...I AM a Vampire...🧛‍♀️💜,neutral,neutral
Thank you kindly.... I appreciate the support. Could you elaborate on the tip please? Thank you,gratitude,gratitude
Why exactly would I be talking to other men about sex in any circumstance? I'm not in prison,neutral,neutral
Last time i knew stealing posts from other people wasnt a rule,annoyance,annoyance
It's cuz we've played less games than them,neutral,neutral
Kinda reminds me of Arctic Monkeys' 'Favourite Worst Nightmare' cover art,realization,realization
Petey ot [NAME]. Let's go. Hockey gods cannot forsake us this much,neutral,neutral
Translation: you should see her vagina! She can't fight you off! The double entendre is more than a bit unsavory.,disgust,disgust
"Most do, some are more reactable than others, like warlord and kensei, some are ridiculous like shinobi or conq or uncharged sb from warden",neutral,neutral
You probably didn't know the right people,neutral,neutral
"I see, Unfortunately I don't think equity has ever turned out well in history. Humans have tried many times and failed with catastrophic consequences.","disappointment, neutral",disappointment
the excitement when they all first come in always makes me happy,"excitement, joy",excitement
"ill [NAME] has already phoned his imaginary boss in for sick leave, [NAME] the [NAME] has patched ASDA. Man the Twitter barricades: they’re coming!",neutral,neutral
"If an addict gets clean of booze/drugs, you congratulate them! What a horrible crabbycrab to try to shut down someone who got their addiction under control.","annoyance, disapproval",annoyance
100% feel for you. I may be exaggerating slightly but still it’s all these little disadvantages that we get put at because of this ping.,caring,caring
This live thing is so bad that i just poured a tall glass of scotch on a work night because there’s an hour left.,neutral,neutral
Why are people downvoting this instead of providing arguments against it?,neutral,neutral
Well I wish we could all get along too.,desire,desire
"I was going to put in the post that I wanted to smack her, but here in the comments I'll say, I wanted to smack her. ","anger, desire",anger
Idk why but your comment in particular made me audibly crack tf up,amusement,amusement
"I can't see a way forward, neither the government or the opposition wants no-deal or to cancel A50. ","disappointment, disapproval",disappointment
Well it would have been ugly tonight without him. And many nights.,neutral,neutral
I'd rather have [NAME]. Killing her off was a waste.,neutral,neutral
"Yeah. You wanna call me a liar, explain why, liar.",curiosity,curiosity
lol classic [NAME],amusement,amusement
To be honest he doesn't have to be sorry for smoking weed. Your neighbor is a yuppy.,neutral,neutral
Anyone remember mean [NAME] burger and fries? That place was the jam!,"admiration, curiosity",admiration
I do this while not high.,neutral,neutral
She's absolutely stunning in that photo,admiration,admiration
"This, and its about to (already has, reallly) start happening to [NAME].",neutral,neutral
I wish this was animated.,desire,desire
He had a hat trick with Cruz Azul in what I think was his debut in the CONCACAF Champions League. Really wish he was given more of a chance,"desire, optimism",desire
Nope. This guy is legitimately this dumb.,"annoyance, disapproval",annoyance
"Appreciate the reply, I'll look into these. Thank you!",gratitude,gratitude
They took my favorite hair gel!! The bastards! Good thing I took a picture of it beforehand just in case,"anger, relief",anger
"What a bullet, and what a sequence for [NAME]",admiration,admiration
I wish I could upvote this a thousand times,desire,desire
Don't make me talk about [NAME]... ...,disapproval,disapproval
They really need to bring [NAME] son back to do more flashback scenes of young [NAME]. That would be SO GOOD,admiration,admiration
"Wow im glad my uncle is dead , this sounds crazy .","joy, surprise",joy
Ugh gross. Don't suggest a PUA book to a kid.,annoyance,annoyance
"Lol that's my cat, he sometimes does that when he eats too fast or we switch his food, he is okay haha",amusement,amusement
Keep watching!,neutral,neutral
"It's been 10 minutes, I'm still laughing 😂😂😂",amusement,amusement
Didn't know it could get that cold in the US (I assume).,neutral,neutral
I cried I was laughing so hard,amusement,amusement
I was thinking the same thing as well. Glad to know I'm on the right page.,joy,joy
"Um, excuse me? I'm a *rolling* rabbit hole, thank you",gratitude,gratitude
step 1: remove yourself from the mass media,neutral,neutral
Just keep trying. Dont give up! If you are getting numbers that is half the battle...seriously.,"caring, optimism",caring
Nah. Been over it pretty much since [NAME] said the Vikings did it too. Pretty hard to be mad when we were just as guilty.,remorse,remorse
Ill give you a hint where i run my business now its on a beach in india if you find me i will give you your payment,neutral,neutral
"""I guess """"hungasfuck"""" or whatever is not doing gif recipe vids anymore lol""",amusement,amusement
Makes it even weirder that she now hates America,anger,anger
Where the hell do you live where you can't find pork rinds?,neutral,neutral
*Hey just noticed..* it's your **8th Cakeday** jama211! ^(hug),joy,joy
[NAME] makes me want to punch ugly pillows.,annoyance,annoyance
"Oh, because his sideburns were shaped like stars!",neutral,neutral
"Bit of a rant there, but I get it. This comes off as super pretty. ",admiration,admiration
Bro he has always been a bully in the community. He is a pseudo scientist.,annoyance,annoyance
i guess you must eat filets and lobster at all your parties haha,"amusement, optimism",amusement
Normally drop n roll. In this case I would remove my clothes because I doubt rolling would help.,confusion,confusion
Uhh. Okay. Lol.,"amusement, approval",amusement
Both my kids went down with it about a week ago,neutral,neutral
"Well [NAME], you got the wrong guy. I never downvoted you. I hope your day gets better.","disapproval, optimism",disapproval
LOL. Glad you noticed.,"amusement, joy",amusement
Try to get between us and our maple syrup and see what happens,neutral,neutral
Well damn I guess I timed this post pretty well lol,amusement,amusement
You’re welcome 😊,neutral,neutral
This little piggy went to the hospital...,neutral,neutral
The thought of shooting anything at asylum seekers is appalling.,fear,fear
It's the right sub but why did we even set-up so defensively in the first place? Utterly bizarre.,curiosity,curiosity
Much better thanks hun !,gratitude,gratitude
"I am glad that the message touched you, I really am.",gratitude,gratitude
This is hilarious! Sounds similar to my buddy's experience at his gym in CoHeights!,amusement,amusement
thats some very advanced way of thinking - and I dont think I was able to do that when I was 18,admiration,admiration
It doesn't add up that a person who was receiving threats took actions to stop receiving threats?,neutral,neutral
I'm surprised no one's talking about the guy in the picture. What a thrussy!,surprise,surprise
You mean pan de huevo Check food city,neutral,neutral
I hope having family in high places will help me gain opportunities to liberate others.,optimism,optimism
That's an excellent point. Who would be a good '[NAME]' for the Oilers?,"admiration, curiosity",admiration
They should fight to have Vans remove the [RELIGION] star from the back of their shoe.,annoyance,annoyance
"Go with her, eat healthy food with her too. It may help","approval, caring",approval
I would pay money to see the security cam footage of that.,neutral,neutral
Looking forward to seeing these people have their characters die in sudden and extravagant ways.,neutral,neutral
we can only hope,optimism,optimism
"Well, its been hours and I was correct. The OPs comment was totally 100% incorrect. Have a great day, thanks for playing. LMAO!","amusement, disapproval, gratitude",amusement
"""[Licks salt] """"Hey guys, this *definitely* isn't snow!""""""","approval, neutral",approval
She's a ~~chill cat~~ woman of few words.,neutral,neutral
Gaaahhh. That one would hurt.,sadness,sadness
"This is like the third repost of this. But yes, very sad indeed.",sadness,sadness
"exactly how i feel about it too. the guy is just a jerk, and can't be bothered to care unless it benefits him. selfish little prick",annoyance,annoyance
"Right, that makes sense! I wonder if the person I met in real life would acknowledge he's more of a fence sitter than childfree, haha",surprise,surprise
"That’s kind of what makes the “guest” response funny, how did it get there?","amusement, confusion, curiosity, joy",amusement
She did.,neutral,neutral
But her cancer the second time was caused by the chemo! /s,neutral,neutral
"Ah, the word alluded me.",realization,realization
I love Skyline Chili but I totally understand why other people don't. Same with Imo's.,love,love
Such grace.,"admiration, neutral",admiration
You didn't like the joke? I thought it was an instant classic.,approval,approval
That's pretty funny imo,amusement,amusement
keep spinning that hamster wheel,neutral,neutral
Tbh the giant cereal bowl bath is about as least cursed as it gets. ...I loved that episode,love,love
Nah. I just need to stop answering before I go to bed. Got the post and the replies mixed up in a sleepy haze.,disapproval,disapproval
I test ENFP and I relate to this thread so much.,neutral,neutral
That’s nightmare fuel right there,fear,fear
I love pasta and sushi more than anything! :),love,love
Well one of our leading candidates is [NAME] so it's not like we're killing it in our search either,"annoyance, disapproval",annoyance
Does anyone know how much the skin is supposed to cost? Edit: And does it put the lotion on it's skin?,curiosity,curiosity
I heard rumors of this. From what I understand the plan is to set off nukes to get the core spinning again. Awesome Movie Reference BTW!,admiration,admiration
Ahh. Both of those are very good. Hope you enjoy them as much as I did.,optimism,optimism
2nd Intermission question: whose football team is in the playoffs Rn? How about them Seattle Seahawks!!,neutral,neutral
"Kinda torn. I want us to come back, but I also want us to lose bad enough to replace [NAME] quick",neutral,neutral
> [NAME]. You disgust me. But seriously when do we get a real show and skip the constant ad teases.,disgust,disgust
"Was going to say, that’s common practice for most women’s health appointments to help deal with relationship abuse.",neutral,neutral
[NAME] is good but he needs to never take a midrange shot again,"approval, disapproval",approval
"Yeeeaaaah, move out and keep showing off the clam.","caring, neutral",caring
Please try again; even [NAME] would make for a better ending.,"caring, optimism",caring
"Communists love the state, make no mistake. It's either totalitarian statism or mob rule, which commies would fail miserably at. ",approval,approval
This is a genuinely good point. It’s enough to take me from giving zero shits to giving a modest shit against them.,approval,approval
There is a startling lack of empathy in this thread.,"surprise, neutral",surprise
"Incredible work and very unique, good for you",admiration,admiration
I think this title is biased. It groups all media improperly.,"anger, annoyance",anger
Mad respect to her for being honest. I like how they consulted a dietician for their article to confirm a diet of cocaine and tapas was unhealthy lololololol.,admiration,admiration
"Hi dying, I'm dad!",neutral,neutral
"The projectiles are 1L bottles, so more cylinders than spheres. Does it make any difference? ",curiosity,curiosity
i feel like slapping /s after everything sucks the fun out. it's not my fault people are autistic.... /s,anger,anger
Was waiting for them to do it again with him out of the truck,neutral,neutral
"""Do you mean a """"theocracy""""?""",curiosity,curiosity
This is amazing. You look like a video game character whose hair texture hasn't loaded in properly.,admiration,admiration
"Like at the time, he wasn't one of the best defenders in the league. But grew into one. ",admiration,admiration
"""Not only that, the """"improved controls"""" aren't a thing at all. I'm not re-buying Blood Money for nicer graphics. """,disapproval,disapproval
"I apologise, I'm a bit hot headed at times, especially on this account.","remorse, sadness",remorse
I'll second this notion. One of the first things to go is texting when I start getting sad.,sadness,sadness
That’s a straight up ghoul,neutral,neutral
"""""""YOU BUNCHA BASTARDS"""" is one of my favorite quotes hahaha""",amusement,amusement
"Hi somebody, I'm dad!",neutral,neutral
That I was unbreakable. It took some serious injuries in “high school” until I realized that I wasn’t.,realization,realization
"First of all, that's not true in any sense of the terms. Second of all, I'm not a national socialist lmao",disapproval,disapproval
HAHHAHA thats good,amusement,amusement
Well except for keeping it around as it is only hard to learn because of active attempts to wipe it out.,neutral,neutral
In just 1 Year the user who posted this got a lot of karma... interesting...,curiosity,curiosity
"[NAME] got some baby making to do, needs the break",neutral,neutral
... with my stepmom. Haha. Erm.,amusement,amusement
Clouds aren’t pale they’re translucent but ok 👌🏽,disapproval,disapproval
Omg I thought he was actually fired lol. Got excited ! I still approve tho,"approval, excitement",approval
has the face of someone that had one too many pain pills for breakfast.,neutral,neutral
"I don't need any [NAME]. But if At the Gates actually I made a game, I'd be interested.",excitement,excitement
Level 50 and I started playing a few days after launch. And I've been playing whenever I had free time to finish those daily orders.,neutral,neutral
Got to love all the fake fans that know nothing about hockey!,annoyance,annoyance
If your 60 and up you’re probably causing the racism,neutral,neutral
"Well said, being alone is a stronger feeling than love! ",love,love
"E-Mart is from Sinsegae, which means it's a Samsung affiliate.",neutral,neutral
"I agree with you, I just don't believe it will happen.",approval,approval
YOU WIN!,excitement,excitement
This article and the accompanying photos have gone viral. Anyone who knows him personally has probably read it. Dude's probably being shamed and humiliated as we speak,neutral,neutral
love after lockup makes DOT posts look like the most sensible things ever!!!!,"approval, love",approval
Fantastic. Would love to see where its at at 250 and 500 hours - I'm sure still well ahead of my 1/3 hourly.,"admiration, love",admiration
Nurse is by far the most loyal team mate we have!,neutral,neutral
Big if true,neutral,neutral
"aw, thanks! I appreciate that! ","admiration, gratitude",admiration
"I don't know dude, but I'm just saying that it's not weird at all that people are super doubtful whenever posts like this crop up. ",neutral,neutral
"Totally hamberders the President, thank you",gratitude,gratitude
"My feelings exactly. First thought, a sarcastic 'Thanks.'","annoyance, gratitude",annoyance
Just what I need; a video of my commute to work so I can enjoy the experience in my free time.,joy,joy
Thanks for this.😊 I like to learn new things. #experiencematters **Themoreyouknow**🌈 ,"gratitude, love",gratitude
Well who knows what valve thinks. I don’t like Lyrical and Maut either.,disapproval,disapproval
I’m jonesing like [NAME] on her wedding night!!!,neutral,neutral
"The original is funnier... or at least it's funny, to begin with.","amusement, approval",amusement
"Yeah, this seems weird to me, too.",annoyance,annoyance
Hello! Happy new years my friend!,joy,joy
"becasue [NAME] is a propaganda meister, its his job. Come on now ",neutral,neutral
Man they must really hate [NAME] out of position at SF. But let’s play [NAME] at SF that should work.,neutral,neutral
Knife Fight used to be an awesome cooking comp show,admiration,admiration
I wish I could tell you if it was a good t.v. Let me just find the MOTHERFUCKING REMOTE!!!!!!!!,anger,anger
It would work just fine. I wear medium shirts and a small or medium jersey fits me great.,approval,approval
How autistic.,neutral,neutral
So long as it's for the worse I'm all for the wait!,annoyance,annoyance
"Oh yeah, it's really dehumanizing to have respect for people's private property and not steal it from them whenever we feel like it...",annoyance,annoyance
"i see it in a different way, but i understand why you see it like that",approval,approval
That’s crazy! I’ve watched every season 6 times now and I’m just realizing that they are in an office!,realization,realization
Love mine too. t-shirt,love,love
"What’s with that woman waving not to record, thanks [NAME] for nothing!👀😐🙄",neutral,neutral
ITS TO THE POINT WHERE I LOVE AND I HATE YOU,anger,anger
"So if MB3 replaces WCS, who exactly do you see as the future for your forward spots?",neutral,neutral
"I'm 14 stone...so probably about 2 stone over weight. I don't drink alcohol or do drugs, but I love food.... ",love,love
Yeah it's like there's no difference between a prostitute or a girl they date except that one is free and has less diseases.,approval,approval
Teen spirit sure ain't what it used to be...,disapproval,disapproval
"Oh gosh, I can’t wait to see how much you’ve accomplished Mr. Not Retarded Criminal ",excitement,excitement
HOW?!,curiosity,curiosity
💕❤️💕 I believe in you. Stay strong,caring,caring
"This is wild omg. Also, happy cake day twin!","excitement, joy",excitement
FUCKING RIGHT COLIN WHITE AND OF COURSE MARK STONE,approval,approval
Wow now I know there's a twist. Why even watch it?,surprise,surprise
I don’t know man I feel like this goal is just a combination of unluckiness,"disappointment, sadness",disappointment
I mean it certainly is a ritual so to speak.,neutral,neutral
This is funny though.,amusement,amusement
Surprised there isn’t more of this lol,surprise,surprise
Damn this is really uplifting.,approval,approval
The first resonates with me much more than the second.,neutral,neutral
"As of about 15 minutes ago Edit: yes, I know I have a problem",neutral,neutral
"Just spend the next few months emotionally detatching, it makes the break up less debilitating.","caring, disappointment, sadness",caring
also anxious that people will be angry or surprised or upset at me for me never telling people about this before,nervousness,nervousness
"As a teacher with a bunch of sick students, this scares the hell out of me.","fear, nervousness",fear
Came here to say this...... Oh dear OP,approval,approval
Thank you I very much appreciate it.,"admiration, gratitude",admiration
