text,emotions,primary_emotion
[NAME] beat the Bears last season lol,amusement,amusement
how do you think money is created? it is largely controlled by the government and is distributed to create certain results in our society.,curiosity,curiosity
""" """"What do Scottish people look like?"""" How I would love to have been there to take a swing at that softball. ""","curiosity, love",curiosity
I think you're confused I'm asking for upvote posts of women complaining that men are bad. Not men complaining about women.,neutral,neutral
Calm down. It's a real concept.,caring,caring
"Mate, just stop. You’re being an embarrassment.",embarrassment,embarrassment
Shame the 'all in' doesn't apply to managers. He has hired some duff managers over the years.,annoyance,annoyance
Sounds fun from what I’m reading on here.,amusement,amusement
"I know right, im pre everything but sometimes i paint my nails and people will tell me how much they look like a womands hands.",approval,approval
"Oh I thought this was about the Pistons making the playoffs. Since I wasn't paying attention to them, I actually thought it was possible. Ahahahahaha!","realization, surprise",realization
Yea ur probably be super drowsy tho.,neutral,neutral
"It was [NAME] thank you very much, than I'd go to wumpscut. ",gratitude,gratitude
"Yeah, I don’t like my friend’s opinion either",disapproval,disapproval
I didn't downvote you so I couldn't tell yah why. It was definitely infected that's why it was red and swollen.,neutral,neutral
"Let's not try to pretend both were equally bad, [NAME] was magnitudes worse",disapproval,disapproval
The reaction was contained under the bandaid due to big pharma’s nanobot technology to help disguise the TRUTH. :P,"realization, neutral",realization
LEATHAL PAPERCUT BRINGING THE BANTZ,neutral,neutral
"""With the up and coming hit single """"I have a new Daddy every week"""".""",excitement,excitement
Gulags... Brexiteering. The mental condition where delusional and psychotic thinking occur simultaneously.,neutral,neutral
wow - resonates with me.,surprise,surprise
That's what we're doing. It's just on my weeks I'd have to drop them off to her to take to daycare.,neutral,neutral
Maybe I should tell my family to move the Lavvo further south =) people sound nicer there,neutral,neutral
That was awesome. Momentum is really something isn't it?,"admiration, joy",admiration
*various incoherent screaming*,neutral,neutral
"I wonder if it's a deal issue and they are allowed, again, to slip away in the last minute.",surprise,surprise
So we got Summer’s model now. Team STRQ flashbacks next volume?,curiosity,curiosity
"There are no words to help heal your broken heart, but I’m sending you as much love and support I can. ","caring, love",caring
Isn’t SOHR group of people(organisation)? lol dont tell me its just one guy.,"amusement, curiosity",amusement
Doesn't stop you trying to hold court over on the US sub though.,neutral,neutral
No that's your interpretation of the truth. A whore is an old and demeaning term for a professional sex worker. You just get off on being degrading to women.,"anger, neutral",anger
Fun fact: you can stop this by removing the prostate that would be epic,"amusement, optimism",amusement
"All my brother, I'm not talented haha I just steal the credit. ",amusement,amusement
#HARRIS GETS MONEY FROM BIG RETIRED!,neutral,neutral
I wish they would put dfs in for [NAME] right now,desire,desire
love seeing his kids too more [NAME] and [NAME] pls!!!,love,love
[NAME] has 5 goals in 4 games for us doesn’t he?,neutral,neutral
Copy pasta?,neutral,neutral
This would be very much appreciated.,admiration,admiration
Can relate. The spirit kept telling me to move to the Morridor. Total decade+ long disaster in almost every way. Shoulda stayed where I was.,"disappointment, neutral",disappointment
It's so obviously a joke but they took it literally because them thinking it is serious validates their skewed perception of the world.,neutral,neutral
Yea this past season her outfits were horrid,disgust,disgust
"Interesting, but I can't imagine it will be there long until someone steals or destroys it.",curiosity,curiosity
Yes but [NAME] advice is better then some randoms lol he was one of the leagues best ever defenders,"admiration, amusement, approval",admiration
Did anyone see [NAME] get pushed around by [NAME] and [NAME] in the post win lineup? I burst out laughing!,"amusement, curiosity",amusement
"gotchu lol, in that case sorry you got downvoted to hell for this lol","amusement, remorse",amusement
[NAME] is such a wholesome woman. The world needs more people like her.,admiration,admiration
"Right, no one wants to deal with that. ",approval,approval
"Broncos one was harder being state rivals and us being spoken of as possible contenders, only to get smashed after taking an early lead",neutral,neutral
"Thanks for the reply! I appreciate your input. Please keep me in the loop, I’d love to be more active with this if possible.","admiration, gratitude, love",admiration
I like how people are downvoting when this is how so many military coups have happened. I challenge those who downvote to prove me wrong,love,love
The fact that this statement got downvoted shows how worthless some people on here are.,disgust,disgust
Oh come on mom..it's 2019.,neutral,neutral
"Well, i was hoping it didn't run flat.",optimism,optimism
"do some blow and spice, it'll be just another day in Florida for Florida man",neutral,neutral
That's right nearby. Thanks!,gratitude,gratitude
Hope the best for him,optimism,optimism
Damn that was ugly,disgust,disgust
Everyone can tell when dudes do a combover and yet many guys do them,neutral,neutral
"Second quote is [NAME], I will Remember You. She's a great singer :)",admiration,admiration
Good luck mate!,gratitude,gratitude
"yeah violence shouldn't be your goto first option, but the people who pretend words are meaningless sounds are stupid idiots",anger,anger
"I appreciate your post, I’m just nervous is all, thank you","admiration, gratitude, nervousness",admiration
Right on. Hi from saskatoon canada. Take care buddy,caring,caring
"Testing it out in creative it feels like the hunting rifle got a huge buff this patch, cant wait to bring out one of my favorite weapons ",excitement,excitement
"Is pleading the 5th even legal? I mean, people should be forced to defend themselves even from erroneous claims.",confusion,confusion
Guys don’t typically pick up random women at night unless it’s a prostitute.,neutral,neutral
"They don't care, even if that involves bringing any idiot in regardless what they tag along and other tenants have to suffer until or if they move.",neutral,neutral
You’re awesome! :),admiration,admiration
My fiancé had it custom made as an early Valentine’s Day gift!,"joy, love",joy
I feel a deep sense of shame.,embarrassment,embarrassment
Lucky you got a sane dad. Get ready for a world of crazy... just don't get sucked into her toxic world. Good luck.,"admiration, caring, optimism",admiration
I'd enjoy a nice warm hug. Along with a delightful conversation. But that works too.,desire,desire
Just saw your history. Makes complete sense now. Your a trumptroll. Bye.,annoyance,annoyance
"Ah I see, thanks for the insight",gratitude,gratitude
"Yeah whether or not an animal is cute is pretty subjective, I was just in a bad mood when I wrote the post honestly.",admiration,admiration
At least the ice didnt break,relief,relief
Yes it would be a poorly thought out plan... involving alcohol... never heard of one of those.,disapproval,disapproval
"ya primetime game, huge comeback and hardens sheer dominance pulling that team was amazing to watch",admiration,admiration
he refers to marijuana as a narcotic. da fuq??,neutral,neutral
"Ah, that's a tryptan, that can have more pronounced effects indeed.",approval,approval
Tanks being strong is the reason why ADCs get buffed.,admiration,admiration
thanks i hate her,"anger, gratitude",anger
"I've recently figured out I'm the perfect mix of smart ass and sweet, the ladies love it.",love,love
Because we didnt have two top 5 players on the team so the bench needed to be great,approval,approval
Thanks! I like your advice. I'm a mom too. I was even smaller after she was born than before my pregnancy. Weirdness.,"approval, gratitude",approval
Ex-Marines are the best.,admiration,admiration
[NAME] is still trying to wrap his head around how the Browns got [NAME].,neutral,neutral
"Based on a quick google search, there are 65 species of possum, 1 of which is native to North America.",neutral,neutral
"Yeah, somebody needs to seek counseling immediately. ",approval,approval
Well being in the playoff picture for a couple months was fun. What does the draft look like this year?,curiosity,curiosity
Oh boy yeah,neutral,neutral
Can’t wait to go to the Kings game. Especially if they bring this level of fire.,excitement,excitement
"My bf uses profanity, and I don't care. There's no reason for misogyny though.",disapproval,disapproval
"Uh, yeah. That was a dumb question and if you thought it was going somewhere you re dead wrong.",disapproval,disapproval
Yeah nuance is in desperate need. The world is complex. Simple answers using simple binary thinking may not give us meaningful political discourse.,"annoyance, optimism",annoyance
Bitter sweet victory,neutral,neutral
Even the worst pyramid scheme pays out something.,"optimism, neutral",optimism
Is she dead? She looks dead...,confusion,confusion
"""Did you guys notice that one of the headlines on the magazine from the last act said """"A real life marvel"""" I loved that little detail honestly""",admiration,admiration
[NAME] is worse but biden gropes women and little girls,neutral,neutral
Ah the remnants.,neutral,neutral
He’s close. Flip [NAME] to fish for [NAME] Then go out and get [NAME],neutral,neutral
"To be fair, actresses who are famous enough to be stopped on the red carpet get that question at almost any formal event they go to.",approval,approval
we're ok buddy!,neutral,neutral
This was so touching ❤️❤️❤️,love,love
It taunts you,"annoyance, neutral",annoyance
I leave for three weeks in Morocco tomorrow. Excited for the 80 degree temperature swing.,excitement,excitement
I gave the show a chance because I enjoyed Bad Education. AP Bio is pretty bad compared to it. Hopefully season 2 improves.,"joy, optimism",joy
Islanders [NAME] says that given what happened yesterday we win this game 7-2 after a lackluster first period with a [NAME] hat trick.,optimism,optimism
Any broncos fans out there that care to weigh in on this? Interested to hear your thoughts,curiosity,curiosity
Let's get petty! Love it,"admiration, love",admiration
*LGBTs for [NAME]!*,neutral,neutral
We also turned the ball over about a million and 3 times. I'm over it honestly,approval,approval
Her promo's alone would be a great addition to the promotion.,approval,approval
[NAME] WHO IS [NAME]!!!!!,neutral,neutral
Read his post again. 'It's more fact based than Fox.' I'm sorry but you might have some extra chromosomes.,remorse,remorse
They are dumb 43 / 37 year olds.,annoyance,annoyance
I like how adamant you are that you didnt woosh yourself,love,love
What deal did [NAME] make to the **benefit** of the Syrian [NAME]??,"curiosity, neutral",curiosity
Gotta preach the truth!,neutral,neutral
I was dying when he said we got to make love or be a crime,amusement,amusement
"Tell her to stop being so fat, then. Edit: /s",annoyance,annoyance
"Bi people can be attracted to trans and non-binary people, too.","approval, realization",approval
Oh no!,disappointment,disappointment
If they killed off women they’d start finding reasons to kill eachother off soon enough too.,neutral,neutral
Captain you ARE wrong. You’re wrong nooption to argue. I have the final rule ! Nope not gonna listen.,disapproval,disapproval
You got the kindest heart,admiration,admiration
Luckily I don’t like beer so I don’t have to worry about that.. but my love for bread more than makes up for that!,joy,joy
"“[NAME] make y'famous tonight, buddy!” 🤣 Anyway, no manger for him!",neutral,neutral
"We get the same effect with deductions - if you're spending your money on certain things, that money isn't taxed.",neutral,neutral
Why do you think he's right? What reason would a nonprofit newsroom have for publishing sensationalist headlines?,curiosity,curiosity
Not my account. I do not own the [NAME] account on Youtube. Pretending I do is silly.,neutral,neutral
"That goes both ways, their adrenaline and determination would also be through the fucking roof.",anger,anger
"Wow. These people really deserve some *clove*, especially on subshops.","admiration, surprise",admiration
"I wonder what the laws are if you bartered for a gun. I wash your car, you give me a glock.",desire,desire
"""Apparently she was doing the """"gasping fish face thing"""" with a face full of mud when the cops arrived.""",neutral,neutral
Get [NAME] streaky ass tf off this team.,neutral,neutral
Omg! Sounds like [NAME] was right about calling [NAME] a weirdo! That is so so odd!,"annoyance, surprise",annoyance
How dare you assume my mortality! >:O,anger,anger
Scotland the brave. Highland cathedral. My love is like a red red rose. Flower of Scotland.,neutral,neutral
I love you raccoon go blazers,love,love
Hiya! 😃,excitement,excitement
Very very accurate.,approval,approval
"Yep, hell of a listener",anger,anger
"Ooh, I wanna be [NAME]!","desire, excitement",desire
I literally do not like this,disapproval,disapproval
"I live in the South, lol, and this is really accurate.",approval,approval
I mean it’s definitely rushed but your clock is ticking and could be possibly on the verge of running out. I say go for it.,neutral,neutral
Don't make me kiss you!,annoyance,annoyance
Because [NAME] did not create us as apes and yes Science can never disprove [RELIGION].,neutral,neutral
Choking/strangulation is one of the strongest predictors of more severe future violence. Absolutely press charges and take whatever other steps you need to be safe.,neutral,neutral
Jewel mint by Pod Juice for sure is the closest thing to mint pods. Don't know anyone who has replicated menthol yet.,curiosity,curiosity
One of my favorite moments,admiration,admiration
"Was stabbed by a pencil when I was younger, can confirm gave me all the knowledge of the universe.",approval,approval
""" future reference: In the sidebar, """"Google doc with more reference links""""""",neutral,neutral
"The Four Agreements is amazing and life changing. I don't keep that many books in my library, but this one has made the cut.",admiration,admiration
Chilling to think people can kick others under the rug and consider them burdens to do something like THIS,annoyance,annoyance
Yes. We're finishing the script out now. Shooting starts in February.,neutral,neutral
"Makes sense, thanks!",gratitude,gratitude
IM IN ITALY AND WILL HAVE TO STAY UP ALL NIGHT TO WATCH THIS BUT TOTALLY WORTH IT!!!,admiration,admiration
"Lmao, The first thing i did after reading is trying to do it.",neutral,neutral
too much internet,excitement,excitement
"She actually survived the incident, I don’t know if anyone has the article",confusion,confusion
!Messageme creepypost,neutral,neutral
These kids just need to get shot up at Normandy and work in the mills like the good old days.,neutral,neutral
How embarrassing.,embarrassment,embarrassment
You are disgusting.,disgust,disgust
What is everybody obsession with trading away young players in this sub?,curiosity,curiosity
"Downvoted for pointing it out, too!",neutral,neutral
To be fair I was in that crowd and there was barely any room to move.,realization,realization
"its not about claiming its yours, its just about where it is from",neutral,neutral
I have a long term plan. I appreciate the concern.,admiration,admiration
Best post ever,admiration,admiration
"We've got [NAME], [NAME]. I don't think [NAME] understands....",neutral,neutral
Nope. Glad we came out with the W,"disapproval, relief",disapproval
Not sure what carrier you have but TMobile has a pretty damn good scam call blocker included in their plans.,admiration,admiration
Not a single comment from a journo about [NAME] has now successfully integrated RLC.,neutral,neutral
Our crust is way too active for that.,neutral,neutral
I'd still think he is scum. And needs to be imprisoned.,neutral,neutral
What a shame... she was passing really well too...,remorse,remorse
I did ..,neutral,neutral
"Make the fro bigger, and it will be a perfect master piece. Rating 9.9 out of 10",admiration,admiration
art,neutral,neutral
"And let me guess, is our friend [NAME] also shilling his own coin that solves all the problems?",curiosity,curiosity
I’m 27 and I’m still finding high schoolers who look older then me at times still. I feel your pain,caring,caring
All the time,neutral,neutral
Do you think CPS would help your niece get help?,"curiosity, neutral",curiosity
I’m autistic and frankly this is disgusting. To say this about your child implies autism basically makes you worthless.,disgust,disgust
Baby I’m Yours--Breakbot,neutral,neutral
The amount of Islamophobic media bias is disturbing.,"annoyance, disappointment",annoyance
how about now,neutral,neutral
I read these comments assuming the context was the Government. Actually it's probably accurate for both TWD and the Government.,realization,realization
So remember when everyone was reading [NAME] for making a song and performing it on the show around a contrived part of her brand???,neutral,neutral
"The amount of times this happened during the first tides of war event, smh.",disappointment,disappointment
"It's not, and that's a much more engrained problem. Let's not let this one take hold.",neutral,neutral
Now there is no one face to face so tough is an option,"disappointment, neutral",disappointment
Short but sweet,neutral,neutral
Being too scared of calling someone isn’t a disability for fuck sakes... use some common sense and grow up.,"anger, neutral",anger
Idk I’d kind of like [NAME] to come up next year. [NAME] still scares me a little. Not saying I don’t like the guy,"annoyance, confusion, fear",annoyance
this is the best thread ever i s2g,admiration,admiration
That’s another unfair accusation. I spent a lot of time trying to reach an understanding with you.,disapproval,disapproval
9-3 in first straw vote? i was not aware of that.,neutral,neutral
Thanks for your reply! Maybe I’ll try that game with him and see how he responds.,gratitude,gratitude
Wow it's almost as if those losers have a lot of money or something else to leech off of.,admiration,admiration
Be the change you want to see in the world [NAME],caring,caring
"Oh it is, it's just that you know that thing...about the intel",neutral,neutral
This bit was more fun than it should have been.,"amusement, joy",amusement
"The one coach I didn't want to lose, but with a new offense coming in, not a move i'm entirely shocked by. ",disappointment,disappointment
"I was, and it's not. He's mad that someone posts articles he disagrees with. Pathetic and his fury is deranged ",anger,anger
A world where I despise a good number of republicans AND democrats.,disapproval,disapproval
"I hope you’re doing well with RCIA! So sorry for your loss. Praying for you, your family, and your daughter ♥️","caring, optimism, sadness",caring
"This is almost irritating. Like, take a breath, shithead..,","annoyance, disgust",annoyance
I have too! I had to pick up sewing to do it but that has been fun as well!,amusement,amusement
I’m happy. Does that mean I can downvote?,"curiosity, joy",curiosity
"In biblical Hebrew they're called [NAME], soos meaning horse and yaor meaning the Nile, in modern Hebrew they are called hipototam",neutral,neutral
Aren't they concerned about your weight now?,caring,caring
"What? They all look entirely different. Yes, they are all handsome, masculine men, but that's it.",surprise,surprise
Some people enjoy their music and their fans for the sake of others opinions.,joy,joy
"Look at [NAME] and you should be good, he has a career like 58% GB rate ",caring,caring
But then they can't draw the m word,disapproval,disapproval
"Cute, super cute ",admiration,admiration
There just shouldn't be police enforcing nonsense traffic laws. Cops should stay at their station until summoned by a citizen like fire trucks and ambulances do.,neutral,neutral
By “make” you mean smash the box into hundreds of pieces and slobber on the remains in a comical fashion?!?,neutral,neutral
Ooo that unlit totem is thick....,neutral,neutral
>the women's march chairs are so left wing they took a picture with LF.,neutral,neutral
"""At least you didn't open with, """"I was always a big [NAME] supporter..."""" 99% of those go downhill fast.""",neutral,neutral
Tell her off yourself (and poke her in the back) that she's way too old and way too heavy to be pulling this stuff.,neutral,neutral
I think this is one of my favorite Aquaria looks ever!!!,admiration,admiration
TB12 is the greatest,admiration,admiration
Most non immigrants won't do farm work for peanuts either,neutral,neutral
"Kinda both, they maintain a pin-up section in their newspaper bizarrely enough. Not like any of the credible newspapers in the province ever needed that.",neutral,neutral
How is ot unreasonable. You take responsebility for what you breed. This natalist perversion is disgusting. The product didnt fail you. You failed the product.,disapproval,disapproval
"You, telling me that changing the clock increment no.s took 1 month? ",neutral,neutral
Partywolf had 178 losses in a row? Are you seeious? I can't believe that,curiosity,curiosity
"College was the worst and the most miserable time of my life. Adult life, on the other hand, is the best I've had.","admiration, disappointment, disapproval",admiration
This whole comment is just reeeing about reeeing. Reeeception,neutral,neutral
"*Whispers* I dunno man, it's a hard decision",neutral,neutral
What's wrong with your cousin.,curiosity,curiosity
"""Presumably he was more excited about making her stay with some pedo jerkoff fantasy of """"Stockholm Syndrome"""" .. oh she's staying cuz she looooooves me! """,neutral,neutral
The one who accidently paid 1 cent less couldn't have just given the other dumb bitch a penny? smdh,neutral,neutral
This person is a god damn idiot,annoyance,annoyance
"Ahhh, [NAME]: Hero of Eardrums worldwide!",neutral,neutral
"Jokes aside, welding is so fucking fun, and they get paid damnnnn well.",amusement,amusement
Downshifting in a manual to accelerate quicker,neutral,neutral
I want to compete but not wait 1 hour finding unfair matches.,neutral,neutral
If they hadn’t played the Vikings in SBIII it’s a guarantee they would’ve lost,neutral,neutral
"I enjoy the harsh throat hit, reminds me of cigs. Edit: Mango is still my favorite though.","joy, love",joy
I feel the same on [NAME]. She's trying too hard to be hard-hitting etc. Thought she was poor on Thursday.,neutral,neutral
"That is really valuable thank you. Supplying stats definitely will help my writing, so thank you for the feedback",gratitude,gratitude
Meryn fucking Trant? Any boy whore with a sword could beat three Meryn Trants.,neutral,neutral
Women aren’t men. We don’t need multiple sexual partners the way men do.,neutral,neutral
"That's fair. Seems pretty lefty heavy, though.",approval,approval
So really no difference from fox and CNN today...,neutral,neutral
Absolutely! The Republicans are craven,approval,approval
Not starting it at that temperature is a great way to drain your car of an ability to start. Pick your poison.,admiration,admiration
"Good deal, thanks","admiration, gratitude",admiration
"""""""A lion never stretches before it hunts."""" ... Glad to see he's already on board with Green Bays injury first mindset. """,joy,joy
> 1 who was asleep [NAME]? Then who was using the phone at 9:20?,neutral,neutral
Thanks. I appreciate your advice. It is what I was looking for. Thanks again.,"admiration, gratitude",admiration
It’s okay my mother in law left her Prius running outside my house for overnight and most of the next day.,neutral,neutral
"hmm... we don't need [NAME] now, we need ball retention",disapproval,disapproval
"Do i just need to watch just 'some' or all of them, oh and what about his books? I gotta buy them too right?",confusion,confusion
lol the zoomed in crotch on the right,amusement,amusement
Are you actually serious? I'm really interested in the details lol,"amusement, curiosity",amusement
"Not an ulcer (canker sore), like literally a tastebud",neutral,neutral
Honey mustard.,neutral,neutral
"""Tell us more about this """"scaring people as a prank hobby"""" bit.""",neutral,neutral
Yes. I got accused of being a man or a bootlicker because I was a mod in a men's lib sub two years ago.,approval,approval
"This goes hard, keep working just a little bit more on it. It feels like a demo to a cool song Love it","love, optimism",love
Thanks for the laugh lol,gratitude,gratitude
For the love of [NAME] stop making him relevant. Please.,annoyance,annoyance
Am i the only one wondering about the white scrolly bar at the top of this post that has the intro to the story?,curiosity,curiosity
I wanna see [NAME] too at the ASG too!! He gotta show that [NAME] Magic with [NAME] as teammate,excitement,excitement
Dressing room back bone is not somebody who always blames others for his mistakes on the pitch.,disapproval,disapproval
I like how the squirrel play dumb when the cat is watching it. And then Boom!,approval,approval
"Shut up, Mag!",anger,anger
I’d have rated 4.5,neutral,neutral
"Out of curiosity, what will he be working on and how is it different from your role?",curiosity,curiosity
YES EXACTLY THANK YOU ...if only more lower and middle income voters understood this.,"approval, gratitude",approval
