text,emotions,primary_emotion
We will pray for your conversion and for those who misspoke for the church. Keep at it. The fact that you’re here means something wonderful.,"admiration, approval, optimism",admiration
"Through mutual friends, and online forums. I find out most online shooters are more fun when playing in a party and able to chat.",realization,realization
Fuck the cubs,anger,anger
this comment made me very nervous,nervousness,nervousness
The real NZ L&p is lungies & puha!,neutral,neutral
Anybody that puts that many numbers in their handle is an obvious psychopath.,neutral,neutral
Thank you very much. I would certainly make a note of your name.,gratitude,gratitude
Cuties! Love you!,"admiration, love",admiration
"Same here, after she initiated the divorce and acussed me of not doing anything to stop it. ",disappointment,disappointment
Your repeated need to retreat into victimhood is a snooze.,neutral,neutral
>!I mean he did give himself a weird new arm...!<,neutral,neutral
"""I heard it to the beat """"I want you to want me"""" I like your squanch!""","admiration, realization",admiration
Eh. I think either works. But sure. Replies is probably more accurate,approval,approval
"That's what I was going for, but I felt like replying with /r/woooosh was too much of a cookie cutter response. ",neutral,neutral
Girl then DM me if you visit! It’s a great place to live. I moved from NY.,approval,approval
Good luck to you! Also good job for standing up for yourself,gratitude,gratitude
ya keep pretending you can tell people what to do... see how that works out for you,neutral,neutral
> is not needed for dogs. Wrong. In *this* case it wasn’t. It very often is.,disapproval,disapproval
"""We need an update, man. What's this """"Outside"""" like???""","curiosity, neutral",curiosity
He’s a brave man.,admiration,admiration
Hence the apology note.,remorse,remorse
"Hey, can you post a pic (or many) of the chow/corgi mix? I really need to see it. Thanks. Actually, the kittens too. ","curiosity, gratitude",curiosity
"Globalism is cancer, long live the sovereign nation!",neutral,neutral
Good ol retro windows,neutral,neutral
Females would be pressured the other way obviously,annoyance,annoyance
What a goal,admiration,admiration
Waiting to see if a card expansion will make the game fun.,"curiosity, optimism",curiosity
"You can't just assert that something came from nothing, you need to provide evidence for said claim.",disapproval,disapproval
that's adorable asf,admiration,admiration
"[NAME]: So, I hear you guys are doing video tributes now? [NAME]: That's what I thought...",neutral,neutral
Truer words were never typed. Loved that game.,love,love
You know the bulks going well when you ate that much last night that breakfast is a struggle,neutral,neutral
It wasnt a terrible idea until [NAME] got injured and [NAME] got complacent,disappointment,disappointment
Expected that. Thanks for your valuable feedback.,gratitude,gratitude
OMG! 😂😂😂😂,"amusement, excitement",amusement
[NAME] got bigger plans ahead from the looks of it. I see [NAME] in the senate if any democrat has a chance in Texas.,neutral,neutral
"Well, shrinking of your d could be a motivation to quit porn.","optimism, neutral",optimism
"You have a real axe to grind about this. Should've pulled your bootstraps up more and mowed more lawns in the summer, son.",neutral,neutral
You're probably joking but [NAME] has been pretty insightful regarding the yellow vests in France. I was impressed.,joy,joy
Fake news [NAME] never slips,neutral,neutral
The absolute worst!,disgust,disgust
"I’m anxious, he’s shy. We’re both teenagers and from what I understand his parents won’t let him have one",realization,realization
i can't believe i havent seen this before. well i was going to watch nosferatu tonight but change of plan,surprise,surprise
those kids hitting the recitation wobble got me dying low key,neutral,neutral
How about as a whole we just hate snow,disapproval,disapproval
Wow.... So many people here apparently don't know poly relationships exist.... Just say thanks. Why would it be weird?,relief,relief
Remember how we always joke about being willing to buy GameStop for like $3.50? Looks like the other corporations said the same thing.,amusement,amusement
the fact that [NAME] still exists is somehow the strangest thing about this,surprise,surprise
Hallettsville. Awesome square that gets all lit up at Christmas - great places to eat. The best little town in Texas.,admiration,admiration
"You, I like you ",love,love
Grown man bars is still one of my favourite moments in all of battle rap.,admiration,admiration
THIS IS NOT HAPPENING!,disapproval,disapproval
"Wasn't getting anywhere to begin with, might as well have some toxic fun with it.",amusement,amusement
Buddy rocket league fair? I’m play 2 but I play like champion 1 and just get shit teammates 😡,"anger, curiosity",anger
"lol wow missed that, it stays",neutral,neutral
Nah mate. I would kill for 3mb/s. On a good day i max out at about 450kb/s.,neutral,neutral
"Forgot to mention that it contains lanolin, don't know if thats a deal breaker. Regardless, alcohol free emollient + occlusive is the way to go","approval, confusion",approval
"No-no-no-noooo Besides, [NAME] is not a bachelor. He is so in love with himself already",love,love
I can finally play 'Kabhi kabhi aaditi'. Only hindi song I listen to.,approval,approval
"Not true. Our knowledge of it is derived from the fossil record, which is geological.",disapproval,disapproval
>Default mods you people keep saying those words like they mean something.,neutral,neutral
Can’t fault you there,neutral,neutral
disappointing click of the day,disappointment,disappointment
The cognitive dissonance is strong with you.,neutral,neutral
I get hella pissed when people who are shorter than me complain about being too tall.,annoyance,annoyance
Like whoever you want to like but don’t treat people poorly based on superficial factors is ultimately the best advice,approval,approval
"So, you get yo keep the LLR and lose your house/money/car instead? ",curiosity,curiosity
An attractive woman falling down and exposing her butt. It's weird that he'd go so 0 to 60 on such a thing.,disgust,disgust
Is that going up? It seems like back in the 90's it was 16-17.,neutral,neutral
It wouldn’t even have been a month yet though... I can’t believe this bootlicking nonsense is upvoted here. [NAME] supporters everywhere these days smh,surprise,surprise
"I mean just let it go and assume things aren’t going to work out. Drop it, so to speak.",disapproval,disapproval
yesterday was a fucking travesty to the game of basketball,anger,anger
"Wow, kinda lame that if this true, most of us probably don't know about it.",surprise,surprise
"""Classic lab. """"Man that was really tough, but can we go play now?""""""",curiosity,curiosity
Fucking and being a boy,anger,anger
"He will, I feel like it's Christmas Eve and I'm waiting for [NAME].","desire, excitement, joy",desire
Rahway Mechanical LLC should be able to. Great guy,admiration,admiration
I kind of love the rabbit,love,love
I stan ❤️🧡💛💚💙💜,admiration,admiration
So that’s what it looks like when it’s not a flop,optimism,optimism
"What, again? This stupid country!",anger,anger
"i would feel really uneasy knowing i can never visit other countries, i think i would rather have the 50K",nervousness,nervousness
Urgh I feel that. I'm doing an exam next week and I'm gonna have to wait 9 weeks for the results back.,neutral,neutral
This made me soooo uncomfortable yikes,disapproval,disapproval
Ugh thank you everyone 😭❤️,gratitude,gratitude
We don't know for certain but every public comment has stated they are amenable to an extension,neutral,neutral
I’ve heard them say they are less likely to get a job.,neutral,neutral
Rover has treated us well.,caring,caring
That sounds delicious! Looks like I’m making a trip to the supermarket today.,neutral,neutral
i got kangaroo from the meat guys over in U district at University Seafood and Poultry. they have tons of exotic stuff,neutral,neutral
"""""""Cute dog, what's his name?"""" """"[NAME]"""" ( ͡o ͜ʖ ͡o)""","admiration, love",admiration
Have either of you or anyone else in your newsroom faced personal threats because of your work on this project?,curiosity,curiosity
Why irritated? I’m sure you said lots of nice stuff about [NAME] at the time.,annoyance,annoyance
Congrats on approaching the situation with logic unlike most everyone else,gratitude,gratitude
Let's not kid ourselves; most of us [NAME] are like that.,neutral,neutral
"If we can trade down with the jags, send a 5, get their 1, jalen and draft an edge I’ll fuck. ",neutral,neutral
I feel like its got to do with the bad desync in the game right now.,disapproval,disapproval
Oh my gawd. WHAT?,surprise,surprise
Do you have the MVP Giambi card? The stats are nice vs [NAME] but he hasn’t really performed like I expected,"curiosity, disappointment",curiosity
Shhhhh you are devastating their argument. You might trigger them. It’s the only trigger they love.,"anger, annoyance",anger
"Now go to a return? Oh ok, thanks for the store to find something better.",gratitude,gratitude
"""[NAME] IS SO CUTE WITH THE """"MINE"""" SdgksadGDKLSG:""",love,love
I hope he doesn't,optimism,optimism
It would be really bad for relations between the two cities if we took Memphis' NBA team.,disapproval,disapproval
These refs are [NAME] awful. Find a new job,"annoyance, disappointment",annoyance
At what point in your life did you realize you weren’t into it? (I’m also not into it),curiosity,curiosity
Access should be hindered it's getting destroyed.,annoyance,annoyance
Survival of the toughest.,neutral,neutral
"All the smut at Target makes me cringe. That, and the very clearly politically-charged children's books.",neutral,neutral
"Spaceballs the suit case nuke, the kids love this one.",love,love
"Good, don't want speeders in my neighborhood and keeps taxes lower.",approval,approval
"Yeah I feel like we’d be able to do *something*, just not sure what... I find it interesting as hell though! ",excitement,excitement
"I like how she calls him racist, when he didn’t actually say anything racist.",love,love
>pack of sick What does that mean?,neutral,neutral
442 is how many goals we're scoring today,"desire, optimism",desire
Ugh. I wish you were wrong.,desire,desire
This is good,admiration,admiration
The intent is to provide the players with a sense of pride and accomplishment...,pride,pride
I'm not sure. There's some good youtube compilations of him.,neutral,neutral
You can do a blanket report for police to investigate. You don't have to say who you are.,neutral,neutral
Never seen this. Thank you for sharing,gratitude,gratitude
This reminds me of suits. (Currently about to start season four.),realization,realization
"As far as I know, it's still bugged, so just reroll it","annoyance, realization",annoyance
"Your mental health. You might think its fine, but having to live a double / fake lifestyle is wearing on the best of us . ","caring, disapproval",caring
Please don’t marry this man-child.,"sadness, neutral",sadness
It's also had derogatory meaning for nearly 400 years. people with any common sense or taste will generally choose *any* other word.,neutral,neutral
Why so much green though lol,amusement,amusement
In that conversation it was the girl being boring and closed... sometimes it’s not your fault and people feel they’re the ones being awkward,embarrassment,embarrassment
Every time I think about how close we were to getting [NAME] it hurts a little bit more...,sadness,sadness
I will have one of each please. Not just far left and right. All. Any doubles you might have as well. Thanks byeee,gratitude,gratitude
Stay there it’s been good luck,caring,caring
I will tell my NP he may have inspired pancakes in someone's future :),optimism,optimism
That's already a few steps ahead of many people.,neutral,neutral
What did I just read,"surprise, neutral",surprise
Absolutely amazing how people think this is anonymous.,admiration,admiration
"they sounds like autistic meltdowns triggered by an immense fear of vomiting, nothing much to do",annoyance,annoyance
"For every Undertale or Stardew Valley there's dozens, if not hundreds of other games developers put their heart and soul to, but never catch on.",neutral,neutral
"Yeah I'll probably do some baking with it! I might also like it better after a while, I was just very surprised today 😂",surprise,surprise
"Always travel when you get the opportunity, you will never regret it, you will only regret not doing it.",neutral,neutral
Schoolboy Q. - that part That [NAME] feature is intense :D,neutral,neutral
"I agree: most [NAME] are much better than Prophet [NAME], which directly contradicts [RELIGION] doctrine.",approval,approval
> I’m tired of being realistic and open minded. Me too! Now it is all about being selfish and aloof. Not even kidding.,"annoyance, disappointment",annoyance
Ohhhh Thank you! I just found them!,gratitude,gratitude
Omg yes lol it’s the story of my life,amusement,amusement
holy crap that's messed up.,annoyance,annoyance
"Hell, no. Teenagers just aren't that interesting.",disappointment,disappointment
[NAME] nerds thinking they are cool by assigning some bullshit fantasy words to error messages...theater mode is probably just acting up,"annoyance, neutral",annoyance
"Yeah, at least carry a ziploc bag of dead cockroaches with you for this purpose, like a self respecting meal scamming scumbag. ",neutral,neutral
And this young man wishes to be an athlete. That sort of strenuous activity would not be possible.,disapproval,disapproval
[NAME] that was funny too. She was mothering him the whole episode,amusement,amusement
Lol Well you don't know how many miscarriages occur,"amusement, neutral",amusement
I know! I love it..... this is who we really are!,love,love
It developed because of my childhood and robbed me of a good bit of good stuff as an adult.,disappointment,disappointment
Putting them away feels so good it’s worth the frustration. Snipers dropped my career KD by like .15 >__<,"anger, relief",anger
Laughing in spitfire mk va.That plane is amazing Especially on breakthrough,admiration,admiration
This is absolutely the stupidest mock I've seen this year,amusement,amusement
"I just drank some chocolate milk, now I'm a 9/10 supermodel with a great husband and my own island in a tropical location. Thanks! /s","admiration, gratitude",admiration
Rare? HAHAHAHAHAHA,"amusement, curiosity",amusement
"And when it's time to get him into violent videogames, just get him Viscera Cleanup Detail","approval, optimism",approval
"I walked 500 miles and then I walked 500 more, you can’t relate to my pain 😤",sadness,sadness
Still pissed we didn’t hire [NAME]. He would’ve brought [NAME] 😭,neutral,neutral
But it'll hurt,sadness,sadness
Former Mexican president was taking bribes from drug traffickers we need the wall,neutral,neutral
"""""""[NAME] will be Turkey's Vietnam"""" yeah, we saw how that went lol """,amusement,amusement
They look like some healthy multi grain version,neutral,neutral
Big and smooth as a marble.,neutral,neutral
Here we go. What’s wrong with them.,annoyance,annoyance
I hope that's a bug because it looks downright embarrassingly bad,"embarrassment, optimism",embarrassment
This is like the timeline from hell.,annoyance,annoyance
bet you could still eat them,neutral,neutral
"I nailed that one on house boats, did you?",neutral,neutral
Oh forgive us for trying to make an exciting atmosphere at our homecourt.,excitement,excitement
And yet none of ya'll are willing to even let 3rd party candidates in the building. Got to love the hypocrisy,love,love
Don’t tempt me. Maybe do like a photoshoot.. that might work..,neutral,neutral
It’s not outrageous though. Just a 2 night hotel stay alone for 1600 people will be around 200k.,neutral,neutral
*NOW* you understand jokes.,neutral,neutral
How many of these people are from the original Lucasfilm? Before Disney's takeover? Does anyone know?,confusion,confusion
[NAME] I hate Twitter,anger,anger
The Chargers defense looks impossibly bad,"disappointment, neutral",disappointment
Yeah take it slow..I mean you waited 7 years you can wait a bit. Hope it will turn out good for you guys,optimism,optimism
I used the call screening on my sister for a laugh.. she was not as amused as I was :),disappointment,disappointment
"""""""here's where the map completely breaks"""" """"also centurion has safe heavies"""" like really lmao""",amusement,amusement
What is a punishment if not an undesirable consequence imposed by others?,neutral,neutral
"Yes I am. Not sure other than to give me your best answer. Yes, walking in your moccasins is my goal. Thank you.",gratitude,gratitude
The mango pods I purchased in New Zealand gave me a crazy headache but other flavours did not.,neutral,neutral
Lmao the brigading is real,amusement,amusement
AND she was pouring gas on it!! /s,neutral,neutral
"""If you have to ask """"how to know if I'm ready for psychedelics"""" then you are clearly not ready.""",disapproval,disapproval
What are those things it's vomited out?!,neutral,neutral
You assumed that I complained about wl charge. Gg. I never said anything that might help you deduce that. Dude just stfu.,neutral,neutral
Eat the damn rich already!,annoyance,annoyance
Thank you! I had no idea this existed,gratitude,gratitude
[NAME] is my main.,neutral,neutral
Thank you! Took this on my IPhone 7!,gratitude,gratitude
"You’re either mentally challenged or a troll, and if its the secondary you’re horrible at it. ",neutral,neutral
Those are fighting games. Now pick up your pikachu and take a shower little timmy,neutral,neutral
The only winner here is this guys future divorce lawyer.,pride,pride
"yes, also most donut shops like those are cambodian just fyi.",approval,approval
Let us celebrate with a glass of kerbango.,joy,joy
"All the time, you just sort of accept it round here. Butt-hurt mombies and bitter regretful daddicts are what I usually chalk it up to.",annoyance,annoyance
Boy you sure can make some word vomit. You must be scared all the time to have such pessimistic views of people.,neutral,neutral
"Probably just unfairly cherry picking things like his words, actions or writings as if those were at all indicative of his beliefs.",neutral,neutral
You too thirsty,neutral,neutral
Lol at illegals paying taxes. Most do not pay any or pay very little.,"amusement, realization",amusement
I dont believe you,disapproval,disapproval
"Great game, great soundtrack. He was like 19 or 20 when he did that too.","admiration, approval",admiration
I shout at my kid from the sidelines to stop fucking about with the draw-sting on his shorts...think I've got a shot?,neutral,neutral
Ahhhh fond memories,joy,joy
"""It's """"Lo and behold"""" just fyi""",neutral,neutral
Happy birthday and cake day! I hope you find a little bit of joy somewhere in your journey today.,"excitement, gratitude, optimism",excitement
The kind you enjoy & can fully devote yourself to.,joy,joy
"In the short term, yes. ",approval,approval
How is it the worst though? Me and my friends all use it and love it (since 2016),"curiosity, love",curiosity
"I don't wish abortions on any woman. It's a terrible thing to endure. Necessary, sure, but it's still grim.",fear,fear
Good luck.,optimism,optimism
Good job for politicising a tribute to a local TV show beloved by many.,gratitude,gratitude
Is [NAME] back on his meds? This is really calm by his normal standards.,neutral,neutral
"It was probably either a wrong number, a prank call, or a girl you forgot you met and she was embarrassed. If something more happens update us ","embarrassment, optimism",embarrassment
This hits a little too close to home,neutral,neutral
I saw at least one user on this forum talking badly about [NAME] for missing playing time.,disapproval,disapproval
[NAME]. I'm not kidding.,neutral,neutral
I trust Safeway over Great Canadian Superstore for my meats. I know I'm not alone in that regard. Safeway has some pretty good cheaper meats.,admiration,admiration
Wish you could choose to just have two bottles of the Pinot Grigio.,desire,desire
"We had a baby, it's hard to find the time to take them down.",sadness,sadness
I’m so happy for you! Keep doing the damn thing! :):),"admiration, joy",admiration
My wife really likes Deja but hasn’t listened to TDAGARIM. I’m so excited for when she hears it for the first time.,excitement,excitement
"Watch out OP, the choose your own adventure folks could sue.",neutral,neutral
Oh I'm talking about cranberry.,neutral,neutral
The more you know,neutral,neutral
Because it shows that every other woman on earth has rejected him.,neutral,neutral
"Because, “nah you guys go ahead”",approval,approval
I wonder if your mother is proud of the person you became,surprise,surprise
there is no compromise with people who hold the American people hostage for something the American people don't want. don't negotiate with terrorists.,"annoyance, disapproval",annoyance
He's just showing off for the camera there.,neutral,neutral
"I like you. You're smart, cheeky, and funny. Well played.",admiration,admiration
AND HIS FATHER WAS A DRACULA,neutral,neutral
Thanks for taking this on. My daughter's extended family on her father's side do nothing but indulge this crap and it's undermining everything.,gratitude,gratitude
Thanks [NAME] for winning so we don't have to see so much of [NAME] laughable career dwindling away.,"admiration, gratitude",admiration
"Please, just open your heart with us and tell us your thoughts.",caring,caring
No way dude... Always make sure the dude with the camo hat is standing right behind you,neutral,neutral
that's really good,admiration,admiration
Very good fight. The red head above the M is hot and very distracting.,admiration,admiration
dont be scared,neutral,neutral
These 2 are repulsive little kids,approval,approval
"I see, I can't see it. I'm on mobile. Thank you very much for the info. Have a lovely Wednesday afternoon!",gratitude,gratitude
Could this be both proof that [NAME] exists *and* that he has a sense of humor?,neutral,neutral
"Now it's a double birth stone, so it's extra special!",excitement,excitement
"Instagram literally fueles my eating disorder, I can't have it. It is all fake though",disappointment,disappointment
I will still shag her u fooking poof. gave im a rite fockin japester innit well u won't be having erection next few days.,neutral,neutral
Fasting is for [NAME]! Go on a hunger strike!,neutral,neutral
"Uhhhh, existed... Ever been to Arkansas? It’s boring as fuck.","disappointment, excitement",disappointment
"I don't even understand stuff is going on, I just laugh and hope it's at the right time. ","amusement, confusion",amusement
Yaaaaaaas me too!!,neutral,neutral
"""Yeah. """"HEY ARE YOU THE DUDE FROM THE SCAM WEBSITE?"""" [NAME]""",amusement,amusement
i bet her breath stinks,neutral,neutral
"My pride. I'm like a roach, unsightly to look at but determined to survive ",pride,pride
If a player is eligible for the supermax and doesn’t resign the team that signs him forfeits there first round pick to the team who lost the player,neutral,neutral
"If it's legal where you live, then it doesn't really matter what anyone thinks.",caring,caring
"Just [NAME] rush the sub, they can try and get us but we’ll break through like the videos of the England team they tried deleting.",neutral,neutral
Nice. How is prep going??,admiration,admiration
Pretty sure it's a rubber toy made to look like one,approval,approval
How though? I srsly don't get it. Seems pretty racist to me.,confusion,confusion
"You’re welcome, glad to help!",joy,joy
"Its like you are flexing that you have gf ,when most of people here doesnt have that feeling",neutral,neutral
What is he doing here without [NAME]?!,curiosity,curiosity
Funny how the [NAME] leaves the most important item out of their article headline.,amusement,amusement
"Damn, you're right. I could've sworn I saw a 99% up there.",approval,approval
"That's right, always be extra careful around the corner.","approval, caring",approval
Must have been no phones around during slavery,neutral,neutral
That [NAME] cover though... Turned over to [NAME] at that point.,neutral,neutral
what lmao get a grip dude,amusement,amusement
Thank you. I have never seen the word typed in that way before.,gratitude,gratitude
Yikes - I'm so sorry things fell apart for you and imposing a sudden hierarchy on you like that was completely crappy on their part.,disappointment,disappointment
[NAME] poisoned them both,neutral,neutral
you'd have to help them get past [NAME] extremely tough immigration process,caring,caring
We thought we had seen the lowest of the low in 2016. Wait for 2020 it's going to be ugly.,neutral,neutral
Yes! I was lost without subtitles on Sons of Anarchy.,disappointment,disappointment
"[NAME] and [NAME] aren't cousins in this timeline, I believe. Just best friends.",approval,approval
"That's slick, would love to see you guys do it.","admiration, desire, love",admiration
Essence is amazing!,admiration,admiration
Angry old men raise their canes when angry. Raising Cane's is a fast food chicken finger chain.,anger,anger
"Why was it changed to that? An overreaction. Why is it still like that? Laziness or incompetence, take your pick. Edit: clarity",neutral,neutral
No. Being a private investigator isn't illegal.,disapproval,disapproval
You can get a penta from 30 seconds after the quad.,approval,approval
[NAME] is hot garbage.,neutral,neutral
I don't care it's amazing there lol,"admiration, amusement",admiration
Shipping container? More like an entire aircraft carrier covered in it.,"approval, curiosity",approval
I'm in the hospital right now. Should be getting released later today,neutral,neutral
