text,emotions,primary_emotion
Whoa this is really creepy,disgust,disgust
"Ok, I will take this with a pinch of salt, but take it into consideration nonetheless. Thanks.","approval, gratitude",approval
"I love bloodborne, I started my second play through but quit after I got busy with school stuff.. need to go back to it though.. love that game ",love,love
"Oh my goodness, I'm so glad you were there too. You made his day suck a little less. ",joy,joy
Yeah -- a woman who expects a guy to never even think about other women for the rest of his life is a special kind of delusional.,admiration,admiration
100% yes,neutral,neutral
People would still always parry them (600ms) :(,"annoyance, disappointment, sadness",annoyance
Title: geez another douche Text: ooh well lol,amusement,amusement
How do I get one,curiosity,curiosity
"Exactly, thank you. ",gratitude,gratitude
"damn, Now THAT's detail.",neutral,neutral
we go!,neutral,neutral
He hasn't stopped clapping ever since,neutral,neutral
Idk about you but I love crispy vagina,love,love
Let's get skinner locked up for 8 years first. Don't want to upset him before he signs,neutral,neutral
"Thanks, I sort of bought myself the leadership role with that little stunt I pulled. I will do my best. ",gratitude,gratitude
[NAME] looks like a guy who owns a number of body pillows and anime figures.,neutral,neutral
Kill me.,neutral,neutral
She started off with 'can't give it up that easily' Op is stuck with her until one of them have expired!!,neutral,neutral
delusional about dread being a scam (don't know how this would work) and more of these conspiracy theories with zero proof/,"disappointment, nervousness",disappointment
They are the best but my office is so far away 😞,"disappointment, sadness",disappointment
"""""""in2"""" Is this a time saver over """"into""""? This reporter says no.""",curiosity,curiosity
Our local ESPN radio will play commercials for games that happened the previous week all the time. So amateur.,"annoyance, optimism",annoyance
"""Hopefully """"new games"""" doesn't mean """"new ways to put money into other things besides our main games.""""""",optimism,optimism
"Loving the circle-jeck hate, how about not getting so triggered by other people taking offense at an ad",love,love
There are quite a few hideous high rises in dallas. But also some beautiful and iconic ones.,neutral,neutral
I’ll be there later this year. Can’t wait.,excitement,excitement
"What a pretentious, self-promoting post.",admiration,admiration
Don’t tell me what to do.,anger,anger
"Congrats! Enjoy a free slice, I think you know what to do with this 🍕","gratitude, joy",gratitude
"Did a lousy job, my dishes are still dirty.",disappointment,disappointment
Whoever is against the queen will die.,neutral,neutral
"Thanks, we were kinda enjoying it at the time too","gratitude, joy",gratitude
I second that motion...with A VENGEANCE!!,anger,anger
Just goes to show it takes 0 skill to play that hero,approval,approval
>image management issue Seriously?! I must have missed that.,confusion,confusion
I think you have a terrible opinion. Now that we agree on something though this could be the start of a beautiful friendship!,admiration,admiration
well that’s because it’s fake.,neutral,neutral
I'm going to hold out hope for something minor even though it looked really bad. Just going to wait for the official news.,optimism,optimism
Thank you so much for this advice :) i'm just really worried about going through the process again,gratitude,gratitude
Yeah I was impressed with it too! I've to pay to see results of responses past the 100th one but other than that it's top notch,admiration,admiration
I don't think that's how shadowy military organizations work [NAME].,neutral,neutral
I just see two inflated peacocks with a dumb and disgusting look in their face. But unfortunately I am not the gender evaluating them.,neutral,neutral
"""How the hell is that comment """"holding the GM accountable""""""","anger, annoyance",anger
"""Because he's an anti-science fool, like other irrational """"environmentalists"""".""","annoyance, neutral",annoyance
"""It actually amazes me how often children are more sensible than adults. Maybe it's because they haven't been corrupted by """"real life"""" yet.""",neutral,neutral
"Trae getting where he wants whenever he wants, that’s all that matters",neutral,neutral
school is not that bad,approval,approval
I hope he learnt more in his degree than that,optimism,optimism
Indian : Malai kofta at Bombay house Also Balaji Caffe in West Jordan for some authentic South Indian fare,neutral,neutral
As a Florida girl I have no clue how you all have not died. I could never live there.,surprise,surprise
Logic and facts are verboten on that sub. Truly bizarre that people are that sensitive.,neutral,neutral
"Well, whaddaya know!",surprise,surprise
"How he dropped that sheep, probably going to hell but i almost choked laughing. ",amusement,amusement
only took em all of the time to realize,"realization, neutral",realization
tbh college has been a hair easier for me than high school. The worst of it is making tuition and trying to register for classes,annoyance,annoyance
"I love all the cast in the later seasons, but the [NAME] relationship in seasons 2-4 are prime.",love,love
American children raised by English parents can easily end up with accents resembling their parents’.,approval,approval
That's a classic. You have good taste.,admiration,admiration
Oooff I really hope this doesn't happen 😰😨😰,optimism,optimism
I loved coming across this today! Nice work!!,"admiration, love",admiration
"You shouldn't have been leaving anyway, witch. Go write a funding bill. You know... do your job.","anger, neutral",anger
He must really hate changing dies.,anger,anger
"Exactly. I have yet to see a plus sized model without a blemish-free, conventionally attractive face.","admiration, approval",admiration
What's with the buying porn thing? I missed out on it,disappointment,disappointment
"Yep. I found out that a member of the school board is upset about something that happened with their own child, and wanted access revoked for teachers. ",neutral,neutral
Nice ovation when he first checked in and after the tribute video. Also made some noise when he hit a 3 late.,approval,approval
I was thinking that as well after I posted. Some nasty stuff settles on ceiling tiles.,disgust,disgust
"Ooooooooh. Yeah I did not get that. Makes sense, thanks ",gratitude,gratitude
This is going to be a disaster,disgust,disgust
"This is worse, Balo looks like a horse",annoyance,annoyance
"Yeah totally but she was mainly talking about [NAME] coming in and screaming, she wasn’t actually referencing their relationship",neutral,neutral
Sorry for your losses. Keep up the awesome work. Your son will remember your efforts and hopefully be part of your life soon,"admiration, optimism, remorse",admiration
"I can't stand when a team member has no shoes, the sound drowns out other sounds for me and its just incredibly annoying to listen to all game",annoyance,annoyance
Ok guys I'll watch it. When I finish it I'll tell y'all what I think,"approval, optimism",approval
"[NAME] and [NAME], are hands down my favourite AC characters.",love,love
boi that nose job,neutral,neutral
See the other one has advertising that hides the fucking stupid [NAME] that's the difference!,anger,anger
“270 pound pink person” is a great alliteration.,admiration,admiration
You look like [NAME] from firefly :),approval,approval
>It's always possible they will bring back an older villain that is behind [NAME] Ah yes. I can't wait for the [NAME] 3.0/Snoke 2.0,excitement,excitement
"It's ok, it's been posted a lot lately ",approval,approval
"It's a shame he didn't trust you enough to believe you, but instead believed his own assessment of what he was worth.",neutral,neutral
"4 lives essentially, its insane",annoyance,annoyance
That’s my neighbor!,neutral,neutral
Yeah I had android and was having difficulties but I was able to get it easily when using my gf's mac. Thanks!,gratitude,gratitude
This is my ex and I rib about this all the time,neutral,neutral
This made me incredibly happy and incredibly sad. Sometimes this universe robs us of the wrong people.,sadness,sadness
What. The. Fuck.,anger,anger
Great fucking game for [NAME]. And I can't believe some people are trying to hate on him for one TOV in the 4th. This fan base smh,annoyance,annoyance
You have to assert dominance or they'll never learn.,caring,caring
Not my sub not my problem,disapproval,disapproval
"Honestly, they changed writers and it's been pretty good so far, maybe one or two not great episodes this season.",admiration,admiration
Can confirm. My downvote was removed. Added it back just now. Edit: My mistake. It was a different video.,neutral,neutral
People use condoms with their spouse? Are you guys an open relationship or what?,neutral,neutral
Oi he got stabbed in the eye,sadness,sadness
He’s a grumpy boyo,neutral,neutral
"Wow, I had a cousin named [NAME] who ordered corn. Very nice lady, she died 2 years ago. Miss her xoxo",admiration,admiration
Officer [NAME] is the penultimate FA character. Apart from the fact he's attractive of course AAAAAAAAAAAAH,admiration,admiration
People there are great citizens out there who dislike Rick & Morty studies) should be legalized already.,admiration,admiration
So many inaccuracies here.....,annoyance,annoyance
They're not. They're rolling super hard. And loving it!,love,love
"There is nothing this Government could cut that wouldn't upset someone. Sorry, but weez broke.","disappointment, sadness",disappointment
If this data were exportable in CSV format. I would love this website long time. (Github link for feature contributions maybe?),love,love
I hope you get the help you need. Truly.,optimism,optimism
I never will understand the reasoning behind puking in a toilet... Perfectly good bucket right there.,"admiration, confusion",admiration
I’m just glad that the academy is FINALLY progressive enough to nominate a mediocre [NAME] biopic directed by a pedophile.,joy,joy
"I mean, you can't be any more in the friends zone if you have a matching neck tattoo with the chick.",neutral,neutral
All game types are easy ekia. You sound jealous.,neutral,neutral
I see - thank you for the insight.,gratitude,gratitude
Funny how reddit works,amusement,amusement
I love koln,love,love
It's none of your business. Stay out of it.,anger,anger
That’s terrifying,fear,fear
I guess I am totally alone but I am really enjoying the audiobook and haven’t had a single complaint. I’m half way through now,joy,joy
I hope you get the mental help that you clearly need.,optimism,optimism
Speaker hitting that juul,neutral,neutral
Now? Look at what they did to rip the Black Panthers apart from the inside.,neutral,neutral
I will keep that in mind for next time,neutral,neutral
Didn’t you guys have a bowl game?,"confusion, curiosity",confusion
This article gives the details,approval,approval
"Not sure about OP, but caffeine tends to make many people more anxious (especially those with a co-morbid anxiety disorder(s)).","nervousness, neutral",nervousness
Should be nice to we can see full video clip how we died....,neutral,neutral
No refund for services rendered.,neutral,neutral
I find calzone to be... Fatty.,neutral,neutral
"Yeah, assuming what he said is true yes he has a chance, but it's hard to say for sure given the circumstances ",approval,approval
Liquor stores around me used to be closed on Sundays for outdated reason but it never stopped me from going,neutral,neutral
SUFFER MORTALS!,anger,anger
I was about to say the exact same thing so I will add Review to the list instead.,neutral,neutral
SO MUCH.,neutral,neutral
How it feels*,neutral,neutral
This is beautiful,admiration,admiration
I Like [NAME],love,love
I guess I've never seen that written out. Thanks for the correction.,gratitude,gratitude
"""This whole episode is one of my favorites; it has this AND """"Requiem for a Tuesday"""" AND """"the Low-Cal Calzone Zone"""" """,love,love
In what ways has [NAME] out-coached [NAME]? I see this all the time and yet never any examples.,neutral,neutral
"The UK government's No Deal plan is basically to do exactly what they would do if the withdrawal agreement passes, with some caveats, I believe.",neutral,neutral
At least now [NAME] has more time to gain his confidence,optimism,optimism
[NAME] was mediocre for several years in a row even if he was winning. He matches [NAME] more than anyone,neutral,neutral
B-b-but we can't tax them or they'll leave the country...,neutral,neutral
[NAME] (swt) does not need your worship. If you do good deeds and humble yourself and seek forgiveness He might guide you again.,neutral,neutral
"For real we swept Tampa last season? EDIT: Wow we did, our playoff run against them was a different story ","admiration, neutral",admiration
There’s no reason to scare a parent into vaccinating their child with all this crazy talk of measles and polio. Everyone’s right!,neutral,neutral
I’m sure if it’s crusty there’s some flavor.,approval,approval
[NAME] is just pretending to be uncoordinated while he plots to end careers,neutral,neutral
I’m genuinely curious as to how much Netflix is paying people to make memes about Bird Box.,curiosity,curiosity
"Believe you me. TLJ is much, much worse.","disappointment, disgust",disappointment
Reminds me of that tragedy,"realization, neutral",realization
"He is nearly 25, can't shoot, can't dribble and does nothing great. He wont improve much.",disapproval,disapproval
I wish I could get 9 usd per hour in my job. (not American).,"desire, optimism",desire
you are a good man,admiration,admiration
"Idk, I'd say the screams of government pawns dying is a pretty cool sound effect.",admiration,admiration
Hey! Anyone have the DL on this MLM ? Would love some links to send a victim!!,"love, neutral",love
and I was at the playboy mansion...,neutral,neutral
I personally prefer FIT to refer to these kinds of transphobes: Feminist-Identifying Transphobe.,neutral,neutral
The value of the knowledge from the books you could buy is priceless!,approval,approval
I’m so homesick and I come here for photos like this.,"realization, sadness",realization
What does [NAME] do?,neutral,neutral
"No. These are the people who loved someone with BPD, but got used/abused/abandoned by them. It's mostly romantic relationships. Family tends to be on r/raisedbyborderlines. ",disapproval,disapproval
Okay well we should move him to wherever he gets the most opportunity to blitz from LB while our new signee can cover behind,neutral,neutral
"We don't. That is exclusively a leftist thing, and you know it. ",disapproval,disapproval
MTV loves Indiana,love,love
What do you know about art,neutral,neutral
"Out of curiosity, why are you specifically interested in talking to aspies? ",curiosity,curiosity
I love you more,love,love
~~Comrade~~ [NAME] I'm appalled that you would accuse me of using performance enhancing drugs. Neigh! Neigh I say!,fear,fear
That does not look appetizing,disapproval,disapproval
"Well, 1/2 has been done already!",neutral,neutral
Every instagram page posts this lol,amusement,amusement
Man this sucks. Hope you’re enjoying life in a big house with lambs!,anger,anger
[NAME] looking like his older brother on that one.,neutral,neutral
Man up and get yourself a date with a different woman.,neutral,neutral
"Completely correct. But he Might have lost control, blown a tire, etc., or maybe just panicked human error. ",fear,fear
Amazing notes. Posts like this is what make us feel that we are not alone in our struggles.,admiration,admiration
"A supposedly professional article banging on about gammons and insulting people's appearance. Not an impressive display of journalism, just a pathetic blog designed to preach to the choir.",disapproval,disapproval
My thoughts exactly,neutral,neutral
You know [waves hand] Everyone.,neutral,neutral
But...but...I just bought a new gun in Fallout '76.....and America is the centre of the universe!! :'(,sadness,sadness
I got sort of excited and really was hoping it was [NAME]. Obviously it's not.... so yey... mystero.,excitement,excitement
Of fucking course it is...,"anger, annoyance",anger
"The SNP were, I remember [NAME] stridulating about it at conference, but I don’t think it was a go-er.",disapproval,disapproval
I'm going to Rome for a second date. The joys of Bumbling while back home for Christmas and meeting another emigrant.,excitement,excitement
Seems like it’s very hard for her to laugh... I think it may physically hurt her face.,neutral,neutral
Sex is more trouble than its worth just stay inside and send your mind to another dimension.,neutral,neutral
"I get your point. But really, the low prices is just a trap to get more men in lookout for action. It's sad.",disappointment,disappointment
"I mean, I’m an occasional monarchist myself. That doesn’t mean I’m under some delusion that it’s a fix all.","disgust, neutral",disgust
[NAME] is untouchable fam,neutral,neutral
Watch it in German but use English subtitles trust me,approval,approval
Of the 7’1 jacked guy. Yes,neutral,neutral
"Exactly. Its serious, but not serious enough for the NFL. And for the list i made, those People still play in the NFL after suspensions. ",neutral,neutral
Am I confusing you with someone? I thought you had posted that you liked older women.,confusion,confusion
Its hard to explain i feel everything is distant.,sadness,sadness
check out victim of ritual he's one of the best [NAME] players around and he uses a pad. It's nothing you can't get used to,admiration,admiration
"Is calling bullshit allowed in this sub? Cause theres no way this happened as [NAME] described. People don't speak like that, even crazy ones. ",curiosity,curiosity
I’ve always used a medium sized screwdriver but it can mess up the prongs so use a chopstick and you should be fine,approval,approval
What? The claim is 2018 best shooters. Not overall best shooters,curiosity,curiosity
"Yeah, still the wrong strain to even remotely dive into CBD therapy (<0.7, yikes)... but I understand your point.",approval,approval
"Plot twist, she's accepted [NAME] as her Lord and Savior.",approval,approval
Love it yeet,love,love
"I'm so happy for you and so, so, so proud of you. It's HARD to talk to your doctor about this stuff.","joy, pride",joy
What is scary?,"confusion, fear, surprise",confusion
"No, your cookies will end up flat of you so r heat your oven up pre cook. ",neutral,neutral
"I'm totally cool with that too, whats the PSN?","approval, curiosity",approval
That’s not how roundabouts work. You give way to approaching traffic on your right. Doesn’t matter if they haven’t entered yet.,neutral,neutral
"> , believe me. ",neutral,neutral
Being rich isnt the only way to be successful. The first success to conquer is learning to love and accept ourselves,neutral,neutral
Where's the blindfold?,neutral,neutral
Wouldn't the bully be the Polygon employee?,curiosity,curiosity
Is it that common? Here on the tube on London there is barely room to breathe let alone spin so I guess we avoid this kind of crap,curiosity,curiosity
WE LIKE SPORTZ AND WE DON’T CARE WHO KNOWS,love,love
What kind of behaviour is considered unattractive? I'm pretty clueless when it comes to dating.,confusion,confusion
"Oh, totally mistaken - thanks for correcting me! I had read differently, but maybe that's in other states/cities?","confusion, gratitude, realization",confusion
"My mom is the one who posts these, and it isn't a surprise to me.",neutral,neutral
TIL that [NAME] is a guy.,"surprise, neutral",surprise
"Their mere presence is all it takes, but being outgoing, gregarious or charming is icing on the cake.",admiration,admiration
"[NAME] and [NAME] would be amazing, maybe [NAME] too.. The Rolling Stones, [NAME] and [NAME].",admiration,admiration
"Oh, well, you again I tried some stuff, people ignore me anyway",disappointment,disappointment
Oh nice. What lvl on Siege?,gratitude,gratitude
Your artwork is amazing.,admiration,admiration
Fuck is exactly what she's good for,approval,approval
Can confirm he does not follow the 49ers on Instagram.,neutral,neutral
"Gotta admit, I chuckled at this one","amusement, approval",amusement
Yes - thank you for stating it this way - perfectly said.,gratitude,gratitude
"I'd give you a shovel so you could dig your head out of the sand, but I have a feeling you'd refuse.",annoyance,annoyance
I'd be more worried about the kids needing eye protection at that point.,"caring, nervousness",caring
My heart is broken for this woman... I really hope she finds the strength to leave him,optimism,optimism
>!Did the name of the trophy gave away the twist to you?!<,neutral,neutral
That's no hero to me.,neutral,neutral
"[NAME]. Get off of the computer my man. Get some fresh air, there’s a whole world out there. ⛑","amusement, caring",amusement
"4 5 everybody in the car, so come on let's ride!",neutral,neutral
Isn't there a sub for tomorrow exact post?,confusion,confusion
Well thanks for sharing. I loved it. Do you know of any others from them that aren't well known?,"gratitude, love",gratitude
"Same. The low cloud is neat, but to me the emptiness of that area of downtown is what's striking.","admiration, approval, disappointment",admiration
That’s amazing. I hope you feel this way for many many days.,"admiration, optimism",admiration
i'm calling [NAME] noms with [NAME] [NAME],neutral,neutral
"""""""Better my child on death row than lawtistic!""""""",neutral,neutral
Thank you for sharing!,gratitude,gratitude
Hot damn... we're going to Sea World!,excitement,excitement
Boys this team is 🔥🚒,neutral,neutral
"""Never liked hip hop. Grew up around gangster life style, hated it. I also laugh at the """"mythology"""" that grew up around it. """,amusement,amusement
They look prepared for a rugby game breaking out.,neutral,neutral
Thanks for reminding me not to have kids,gratitude,gratitude
"Ok, care to elaborate on what your mysterious link is?",curiosity,curiosity
"Happy for him, great game. ","admiration, joy",admiration
So nice of everyone to welcome [NAME] to his rehab like this.,"admiration, approval",admiration
Finally a whole season and 3 jornadas too late.,disappointment,disappointment
How to flush your money away,neutral,neutral
thanks! nothing else?,gratitude,gratitude
"ball just bounced up a bit as [NAME] hit it, unlucky. Need to test [NAME] more, he's really not that great",neutral,neutral
"I love Earth Balance, but does anyone know if the palm fruit is ethically sourced? I’ve cut out palm products due to deforestation. ","curiosity, love",curiosity
**DON’T USE THESE LINKS**,neutral,neutral
"Om [NAME], who kets their dog fight a croc? ","curiosity, surprise",curiosity
Thanks. People on the sub are unreasonable. They think [NAME] is worth so much yet won't give up much for [NAME],gratitude,gratitude
Never thought I’d see a comrade here,surprise,surprise
"Not a [NAME] fan myself, but there's no reason to comment on his weight or appearance. It only makes your side look bad.",neutral,neutral
Thanks bro. This is do or die for me. Will value my streak like gold.,gratitude,gratitude
I’m guessing this is in response to an advertisement from the shaving company Gillette. missed my chance....”contextttt!”,neutral,neutral
[NAME] just wants to post pics of her facetuned of herself for attention while acting morally superior to those other girls. fuck off,anger,anger
I’d say every of those subreddits are freaking out but it’s basically the same people lol,amusement,amusement
Oh god yes. Top quality cringe. Thank you for sharing,"approval, gratitude",approval
it's basically summer here right now. these posts are clueless.,disapproval,disapproval
"I know, this weekend was absolute worse case scenario ",disappointment,disappointment
"Gettysburg is awesome, I've been twice. I want to go back as an adult! Have fun!","admiration, desire, joy",admiration
I need to shower after reading this,neutral,neutral
"""Nevertheless, it amuses me that they mis-spelled """"literally"""", and *only* """"literally"""".""",amusement,amusement
I think this lady has simply gone bananas.,neutral,neutral
It’s a visual novel too,neutral,neutral
Satire account.,neutral,neutral
The reductionism is the only thing these feeble minds comprehend.,neutral,neutral
Fortnite is not a good game anymore smh my head,disapproval,disapproval
"We *do* deserve animals if we give them lovings! Don’t talk so down about yourself, silly .. that’s what that kitty would say !",caring,caring
Fair enough. You know him better than any of us do.,approval,approval
Good luck with that!,optimism,optimism
This guy is a little turd but I love him so dearly. I'll pass on your kisses :),"admiration, love",admiration
Slightly too pissed off with this comment to merely downvote. Not angry enough to begin tirade. Lunchbreak ruined.,annoyance,annoyance
"Omfg. I haven’t seen this one before, and I’m in tears! Thank you! ",gratitude,gratitude
You sound like my gf. I'm so lucky to have her in my life.,"joy, love",joy
What a complete and utter cunt.,"anger, annoyance",anger
"I would gleefully look forward to a battle where fascist apologists and race baiters utterly destroy each other. Maybe then we can have a civil, unified society.","annoyance, approval, optimism",annoyance
"Aw jeez [NAME], we went from 2D to 2D...",neutral,neutral
[NAME] is bad & anyone who still supports him should feel bad for it.,disapproval,disapproval
Guy on the right looks like [NAME] long lost sister,"realization, neutral",realization
"Welcome from Chapo Trap House... wait, why are YOU guys here? Oh, right.",neutral,neutral
"Like the op said, [NAME] is more of a giver, so I think [NAME] would be happy as long as [NAME] would be happy","caring, joy",caring
